Seasons Beauty Studio,"Shop No 15, Golden Baug, Om Nagar, Mumbai, Vasai West, Palghar - 401202, Opposite Vasai One Building",+(91)-8007722123
Iris Hair & Beauty Salon,"Shop Number 18 Ramtirath Society Limited, Plot No 01,Sector 44/A Nerul (W), Krishna Changa Naik Marg, Seawoods, Navi Mumbai - 400706",+(91)-9619607553
Priyas Beauty Salon & Brida..,"Shop No. 8D, Mukta Bldg., Peru Baug, Off Aarey Road,, Goregaon East, Mumbai - 400063, Near Asaram Bapu Ashram",+(91)-9167610140
New Glow Touch Salon & Spa,"Shop No. 8/10/11/12, RNA Broadband Avenue,, Mira Road, Thane - 401107, Opposite Jangid Complex,",+(91)-9867417917
Kirans Beauty Salon,"Shop No 1, Galaxy Heights, B Wing, Off Link Road, Goregaon West, Mumbai - 400062, Behind ICICI Bank",+(91)-22-28760366
Lavish Spa N Salon,"Shop No. 8 Sky Height, Sriprastha, 4th Road, Nalasopara West, Palghar - 401203, Opposite Virar Nalasopara Link Road",+(91)-8850530453
Mhalsa Spa & Salon,"Tulshiram Gangeshwar Villa, Samartha Nagar, Nandivli Road, Dombivli East, Thane - 421201, Opposite Swami Samartha Math",+(91)-9619434649
Elegant Ladies Beauty Parlo..,"Shop  No-03, Shiv Kripa Apartment , Plot No. B-80, Sector 23, Nerul, Navi Mumbai - 400706, Near Seawoods Station",+(91)-9930688390
Prerana Beauty Parlour and ..,"Shop No 3 Vardhaman Shilp, Plot C. S. No.318, Plot No.160,, Bhandari  House, Girgaon, Mumbai - 400004, Bhaskarbuwa Bakhale Path,",+(91)-9819075899
Krasa,"Genesis Tower, Shop No. 3, Gandhi Nagar, Dombivli East, Thane - 421201, Opposite Subhash Dairy",+(91)-9930173217
Bling Salon And Spa,"Shop No 5 Anand Building, Shraddhanand Road, Vile Parle East, Mumbai - 400057, Opposite Shiv Sagar Hotel",+(91)-9326877673
Scissors Art,"Shop No 5 B Wing Park Paradise Plot No H 43, New Link Road, Andheri West, Mumbai - 400053, Near Oshiwara",07947178599
R Js Beauty Parlour & Class..,"Shop No. 5 Dhiraz Kiran Building, Chincholi Bunder Road, Malad West, Mumbai - 400064, Opp. Infant Jesus School",+(91)-22-28711277
Style On Beauty & Academy,"Shop No -A-08 ,Gayatri Sankul Chs, Plot No -38, Sector-20, Kharghar Sector 20, Navi Mumbai - 410210, Opp. Amrutdhara Complex Chs",+(91)-9326242862
Apaara The Endless Beauty,"Shop No 74, 1 St Floor R Galleria, Goregaon Mulund Link Road, Mulund West, Mumbai - 400080, Runwal Greens",+(91)-22-49766499
Maratha Salon & Hair Wig Ce..,"Shop No. 1, Shri Samarth Niwas, J B Marg, Parel, Mumbai - 400012, Opposite Shirodaker Market, Near Parel Station",+(91)-22-24129048
Sanikas  Beauty Salon,"Shop No:03,Seven Eleven Complex, Park View Hotel Lane, Mira Road, Thane - 401107, Laxmi Park , Kanakia",+(91)-8169358384
Bennys Beauty & Hair Care,"1 E and 1 F, Juhu Supreme Shopping Centre, 8 Gulmohar Road, JVPD Scheme-Juhu, Mumbai - 400049, Near Criticare Hospital",+(91)-22-26209616
Spark The Family Salon,"Shop No.26,27,28, Moraj Residency,Kasturi CHS.,Plot 1, Sector 16, Sanpada Sector 16, Mumbai - 400703, Moraj Residency",+(91)-22-49744888
Fashion Hair & Beauty Salon,"Shop No 003, Aakashganga Mahavir,, MTNL Road, Mira Road, Thane - 401107, Opposite Jangid Circle",+(91)-9819143994
Pearls Spa & Salon,"Shop No 7, Orion Building Cosmos Paradise, Thane West, Thane - 400606, Opp Devdaya Nagar",+(91)-9594035678
Desire Salon and Academy,"Shop No.02 Gokul Village 3, Next to Dr. Suri Clinic, Mira Road, Thane - 401107, Shanti Park",+(91)-7021516157
Yogis Hair And Beauty Studi..,"Ramtirth Co Operative Housing Society  , Plot No 1, Sector 44 A, Seawoods, Navi Mumbai - 400706, Near Palm Beach Road",+(91)-022-27700800
Opus Salon,"1234 Shree Rajeshwari Building, Pk Road, Mulund West, Mumbai - 400080, Near Sarvodaya Nagar,Opposite Raja Industrial Estate",+(91)-9619763363
Shweta Beauty Salon,"Harsh Vihar , Building No 31, Shop No 3, Sector 1, Near By Grasshopper, Shanti Nagar-mira Road, Thane - 401107, Opposite Shanti Shopping Center",+(91)-9923363961
Cabello Hair & Beauty Salon,"Shop No 18, Kamdhenu Shopping Centre, Kamdhenu Apna Ghar Unit No 14 Chs Ltd, Andheri West, Mumbai - 400053, Lokhandwala Complex",+(91)-8291187756
Glamzar,"Biulding. No. A1, Shop No. 2, Tanvar Complex, Mumbra, Tanwar Nagar Road, Mumbra, Thane - 400612, Near Queen Marys High School & Junior College",+(91)-7977952867
Hair Cafe Unisex Salon,"Shop No-3 & 4, Panorama Tower, Veera Desai Road, Andheri West, Mumbai - 400053, Near Prathmesh Complex",+(91)-8879487115
Tip Top Unisex & Spa Salon,"Shop No 1 Samikaram Plot No 34 B TPS V, Sant Janabai Road, Vile Parle East, Mumbai - 400057",+(91)-9082555767
Prachi Beauty Parlour & Cla..,"Shop No 6 , Suyash Apartment, New Prabhadevi Road, Prabhadevi, Mumbai - 400025, Near Samana Press",+(91)-9821569892
Lofiel Beauty & Hair Salon,"Shop No 4, Govind Apartment, Chandansar Road, Virar East, Palghar - 401305, Near Tandul Bazar",+(91)-8806957811
Golden Crown Family Salon,"Shop No -3 ,Plot No -1 New Satara, Sector-14, Kopar Khairane, navi mumbai - 400709, Near Gahlot Collage",+(91)-8850485241
Hemas Spa  Salon,"C65 03 Virat Appt, SECTOR 4, Cbd Belapur, Navi Mumbai - 400614, Near Market",+(91)-8767384242
Panyas Salon  Academy,"Shah Alpine ,Shop No 8 Sector -6, Kharghar, Navi Mumbai - 410210, Opp - Global IT Shop",+(91)-7506850103
Megha Jains Laser  Salon & ..,"1 , Jain Mention , Daftari Road ,, Near Samsung Shop, Malad East, Mumbai - 400097, Next to Doctor Oza Clinic",+(91)-9004662975
Curl N Care The Beauty Loun..,"Shop No 7, Premji Kanji Visariya Chawl, T J Road, Sewri, Mumbai - 400015, Opposite Dosti Flamingo",+(91)-22-24123606
SP Family Saloon and Spa,"Shop No 14 , Riddhi Siddhi Heritage , Near ICICI Bank , Patni Road , Sector No 19, Patni Road, Airoli, Navi Mumbai - 400708, Near ICICI Bank",+(91)-7777009579
Cabello Hair & Beauty Salon,"Shop No 18, Kamdhenu Shopping Centre, Kamdhenu Apna Ghar Unit No 14 Chs Ltd, Andheri West, Mumbai - 400053, Lokhandwala Complex",+(91)-8291187756
Krishnas Hair And Beauty St..,"Shop No 01 Sukhkarta 02 CHLS  Plot No 30, Sector 42, Seawoods, Navi Mumbai - 400706, Near D Mart",+(91)-9920918581
SP Family Saloon and Spa,"Shop No 14 , Riddhi Siddhi Heritage , Near ICICI Bank , Patni Road , Sector No 19, Patni Road, Airoli, Navi Mumbai - 400708, Near ICICI Bank",+(91)-7777009579
Megha Jains Laser  Salon & ..,"1 , Jain Mention , Daftari Road ,, Near Samsung Shop, Malad East, Mumbai - 400097, Next to Doctor Oza Clinic",+(91)-9004662975
H 2 T Salon and Spa,"Shop No 7, Jaiganaga Chs , Ever Sai Enclave, Mira Road, Thane - 401107, Near Wockhared Hospital ,Opp Sao Ashirwad Hospital",+(91)-9867253288
Curl N Care The Beauty Loun..,"Shop No 7, Premji Kanji Visariya Chawl, T J Road, Sewri, Mumbai - 400015, Opposite Dosti Flamingo",+(91)-22-24123606
Panyas Salon  Academy,"Shah Alpine ,Shop No 8 Sector -6, Kharghar, Navi Mumbai - 410210, Opp - Global IT Shop",+(91)-7506850103
Sweet Angel Parlour,"Shop no.06, Neelkanth Arcade, plot no. 94, Sector 17, Kopar Khairane, Navi Mumbai - 400709, Near Moraj Tower",+(91)-22-27558899
Ds Reflections Ladies Beaut..,"Shop No 1, 2,3 Ground Floor, Kshitij Tower, N D Patil Road, Chembur East, Mumbai - 400071, Opposite to Convent View Society , Near Maitri Park",+(91)-9223506887
Sanjanas Beauty Parlour,"SHOP NO-3, JAI SHEETAL COMPLEX, INDRALOK PHASE -3, Bhayandar East, Thane - 401105, Near OM SHANTI CHOWK",+(91)-8898741785
Theglambar Salon,"Shop No 7 , Fantasy Apartment, Seven Bungalow,  Versova, J P Road, Andheri West, Mumbai - 400061, Opposite to HDFC Bank",+(91)-9107700099
Nu Look Unisex Saloon,"#1 Peraj Palace, Tilak Road, Ghatkopar East, Mumbai - 400075, Opp Gurukul School",+(91)-9653135294
Ash Beauty World Spa Salon ..,"Shop No. 01 Ramanand Apartment Divagaon, Airoli Sector 9, Navi Mumbai - 400708, Near Vithal Mandir",+(91)-8356091378
Sweet Angel Parlour,"Shop no.06, Neelkanth Arcade, plot no. 94, Sector 17, Kopar Khairane, Navi Mumbai - 400709, Near Moraj Tower",+(91)-22-27558899
Shaft & Beyond Unisex Salon,"Shop No G14 Ground Floor, R Galleria, Runwal Greens, Goregaon Mulund Link Road, Mulund West, Mumbai - 400080, Next to Fortis Hospital, Opposite Food Studio",+(91)-7400066607
Lavish Unisex Hair & Beauty..,"Shop Number 10, Tulsi Heights, Plot Number 25, Sector-22, Kamothe, Navi Mumbai - 410206, Near Reliance Fresh",+(91)-8668296607
Billionhair Unisex Salon,"Shop No 3, Suyog Apartments, Laxman Mhatre Road, Dahisar, Mumbai - 400068, Near Marry Immaculate School",+(91)-9076330003
Dipika Mehendi Artist & Cla..,"Saurabh Chsl, Plot Number 383, RSC 30, Sector 3 Charkop, Kandivali West, Mumbai - 400067, Near Dominos Pizza",+(91)-9960684742
B Dazzled,"Shop No. 5 Satlaj Society, Wayale Nagar, Kalyan West, Thane - 421301, Aarti Nagari",+(91)-9167822948
Hair Affair,"Shop No 17/18, Vasudev Sky High, Kanakia Road, Beverly Park-mira Road, Thane - 401107, Opposite Bhairav Residency Lane, Near Water Tank",+(91)-9819307530
Touch & Glow Hair And Beaut..,"Shop No 70 /697 Suryadarshan Chs Ltd, MHB Colony , Link Road, Mahavir Nagar-Kandivali West, Mumbai - 400067, Opp Sankalp Hotel Near SBI Bank",+(91)-9137498342
Royal Unisex Salon,"Shop No 6, Ashish Chs Ltd, Mahakali Caves Road, Andheri East, Jijamata Road, Andheri East, Mumbai - 400093, Near Satya Sai Baba Mandir",+(91)-9768815720
Opus Salon,"1234 Shree Rajeshwari Building, Pk Road, Mulund West, Mumbai - 400080, Near Sarvodaya Nagar,Opposite Raja Industrial Estate",+(91)-9619763363
Looks Spa Salon & Academy,"103,Uma Nilkanth Appartment, Palghar West, Mahim Road, Palghar, Palghar - 401404, Opposite Hotel Sadguru",+(91)-9225958880
Manissha Shah Makeup Artist,"B/305, Venkatesh Kirti Bldg, Balaji Complex 150 Feet Road, Bhayandar West, Thane - 401101, Nr IDBI BANK",07947457330
Sangeeta Beauty Parlour,"3/26,Housing Board Soc., Road No.2, Goregaon West, Mumbai - 400104, Opposite Prabodhan Krida Bhavan",+(91)-8369760127
Hair Affair,"Shop No 17/18, Vasudev Sky High, Kanakia Road, Beverly Park-mira Road, Thane - 401107, Opposite Bhairav Residency Lane, Near Water Tank",+(91)-9819307530
Beauty Town Aesthetic Clini..,"Shop No. 3 Dom-Marian Co Oporative Housing Society, B.P Road, Thane West, Thane - 400601, Rajan Vichare Office",+(91)-9867420521
Royal Unisex Salon,"Shop No 6, Ashish Chs Ltd, Mahakali Caves Road, Andheri East, Jijamata Road, Andheri East, Mumbai - 400093, Near Satya Sai Baba Mandir",+(91)-9768815720
Tip Top Unisex & Spa Salon,"Shop No 1 Samikaram Plot No 34 B TPS V, Sant Janabai Road, Vile Parle East, Mumbai - 400057",+(91)-9082555767
B Dazzled,"Shop No. 5 Satlaj Society, Wayale Nagar, Kalyan West, Thane - 421301, Aarti Nagari",+(91)-9167822948
Touch & Glow Hair And Beaut..,"Shop No 70 /697 Suryadarshan Chs Ltd, MHB Colony , Link Road, Mahavir Nagar-Kandivali West, Mumbai - 400067, Opp Sankalp Hotel Near SBI Bank",+(91)-9137498342
Bharti Didis Beauty Parlour,"Ground Floor, Malati Bhuvan, RHB Road, Mulund West, Mumbai - 400080, Opposite Jalaram Dairy, Near Bavaji Ki Zhopdi Ashram",+(91)-9892271090
La Grace Beauty Clinic,"U L 13, Gagan Shopping Arcade, Gokuldham-goregaon East, Mumbai - 400063, Opposite Minakshi Tower, Near Gokuldham School",+(91)-22-28403337
Tip Top Unisex & Spa Salon,"Shop No 1 Samikaram Plot No 34 B TPS V, Sant Janabai Road, Vile Parle East, Mumbai - 400057",+(91)-9082555767
Iphi Unisex Salon,"Shop No 7, Sai Krupa Co-Operative Housing Society Pvt Ltd, Plot No D8, Sector 12, Kharghar, Navi Mumbai - 410210, Near Utsav Chauk",+(91)-8928342698
Manissha Shah Makeup Artist,"B/305, Venkatesh Kirti Bldg, Balaji Complex 150 Feet Road, Bhayandar West, Thane - 401101, Nr IDBI BANK",07947457330
Pink Me Up & Ink Me Up Beau..,"At-2, Shram Sadhana, DV Pradhan Road, Road No. 1, Dadar East, Mumbai - 400014, Near Dadar T T",+(91)-9987423616
Heena Beauty Parlour & Spa,"A 503, Ushanagar,, Bhandup West, Mumbai - 400078",+(91)-9284288699
Look Salon,"Shop No 3 Building No 14 Mhada Residential Complex, New Link Road, Andheri West, Mumbai - 400053",+(91)-7400012062
Tejaswini Beauty Parlour,"Omkar Tower, Jai Bhim Nagar, Gen A K Vaidhya Marg, Goregaon East, Mumbai - 400065, Near Santosh Nagar Market, Beside Chamunda Jewellers",+(91)-9834239623
Ash Beauty World Spa Salon ..,"Shop No. 01 Ramanand Apartment Divagaon, Airoli Sector 9, Navi Mumbai - 400708, Near Vithal Mandir",+(91)-8356091378
Hair Cafe Unisex Salon,"Shop No -5, Nebula Bldg, 4th Cross Lane , Lokhandwala Complex, Lokhandwala Complex, Andheri West, Mumbai - 400053",+(91)-9702329344
Musk - A Bespoke Salon,"Shop No.8, Victoria Appartment, Vohra Colony, Mathuradas Extn Road, Kandivali West, Mumbai - 400067",+(91)-9619501733
Green Imagee Hair & Beauty ..,"Shop No 5, Royal Apartment, Indralok, Bhayandar East, Thane - 401105, Opposite Tirupati Dream Building",+(91)-9930360096
Nazims Salon And Academy,"Shop No. 1 Plot No. 204/10 Sahayya Ozone Building, Old Panvel, Panvel, Navi Mumbai - 410206, Near Suruchi Hotel",+(91)-022-27458005
Pramila Beautician,"Bldg No 5, B Wing, Matru Chaya Chs, Tilak Nagar, Mumbai - 400089, Near Sahakar Plaza Cinema & Opp Aamchi Shala",+(91)-9967540978
Kirans Professional Family ..,"Shop No 1, Kuldevi Niwas Block A, Shubhash Tekadi Road, Ulhasnagar No 4, Thane - 421004, Near Dashmesh Darbar",+(91)-8805884329
Hirals Beauty Salon,"Shop No 41, Sunderlal, Old Nagardas Road, Andheri East, Mumbai - 400069, Near Jain Hospital",+(91)-7977279694
Scissors Noise The Family S..,"Shop No 226 & 227, Ground Floor, Raghuleela Mall,, Sector 30 A, Vashi, Navi Mumbai - 400703, Near Mall Exit",+(91)-8779274431
Stylish Lady Beauty Parlour,"61/507, Unnat Nagar Road Number 2, Goregaon West, Mumbai - 400062, Near Off S V Road, Unnat Nagar, Behind Nana Nani Park",+(91)-9820606918
Shee Style Beauty Saloon,"Shop No.2 1st Floor, Eco Residency, Off Marol Military Road, Andheri East, Mumbai - 400059, Next to Keys Hotel",+(91)-8452053306
Prachi Beauty Parlour & Cla..,"Shop No 6 , Suyash Apartment, New Prabhadevi Road, Prabhadevi, Mumbai - 400025, Near Samana Press",+(91)-9821569892
Waters Salon,"Nargis Villa, Carter Road, Bandra West, Mumbai - 400050, Near Rizvi College, Opposite ICICI Bank",+(91)-22-26000911
Prerana Beauty Parlour and ..,"Shop No 3 Vardhaman Shilp, Plot C. S. No.318, Plot No.160,, Bhandari  House, Girgaon, Mumbai - 400004, Bhaskarbuwa Bakhale Path,",+(91)-9819075899
Solutions Salon & Academy,"Shop No 1, Shree Sai Krishna Niwas, S K Bhole Road, Dadar West, Mumbai - 400028, Opposite Sahakari Bhandar, Agarbazaar",+(91)-9987109588
Cinderellas Sharons Rose Be..,"Chandrakala Niwas, Hanjar Nagar Road, Andheri East, Mumbai - 400093, Near Ambika Tower, Next Shiv Sena Branch",+(91)-9967936773
Geetas Ladies Beauty Parlou..,"Classic Shayona Shop No 04 Plot No 186/187, Sector 04, New Panvel, Navi Mumbai - 410206, Opposite Hybrid Bakery",+(91)-9920073368
Diamond Ladies Beauty Parlo..,"Shop Number 5 Gokul Co Operative Housing Society  Plot Number 186/187, Sector 4, New Panvel, Navi Mumbai - 410206, Opposite Hybrid Bakery",+(91)-9819717581
Sweet Angel Parlour,"Shop no.06, Neelkanth Arcade, plot no. 94, Sector 17, Kopar Khairane, Navi Mumbai - 400709, Near Moraj Tower",+(91)-22-27558899
M 78 Beauty Salon Spa And A..,"Lok Nisarg HSC B/4 Shop No 03 Ghati Pada Near Gala Factory Vaishali Nagar, Off Lbs Marg, Mulund West, Mumbai - 400080",+(91)-22-21645493
Kirans Professional Family ..,"Shop No 1, Kuldevi Niwas Block A, Shubhash Tekadi Road, Ulhasnagar No 4, Thane - 421004, Near Dashmesh Darbar",+(91)-8805884329
Professionnel Unisex Salon,"Shop No 1. Parekh Mahal, L.J.Road, Dadar West, Mumbai - 400028, L. J. Road Near Ashraya Hotel Lane, Shivaji Park,",+(91)-9223382845
Lovely Salon Spa,"Shop No 5, Mamta Co Operative Housing Society, Kharegaon Naka Road, Kalwa, Thane - 400605, Near Hotel Rajdeep",+(91)-022-25429723
Rouger Ladies Beauty Salon ..,"Shop No 15, Ground Floor, Ashar Infinity, Ashar Complex, Pokharan Road No 2, Thane West, Thane - 400601, Near Reliance Mart, Near Prashant Corner",+(91)-22-21719977
S - Dazzle Bollywood Make O..,"Shop No -2, Parshavmilan Building, Sector-11, Kamothe, navi mumbai - 410206, Opp. Sushma Patil School",+(91)-7400113709
Yogis Hair And Beauty Studi..,"Ramtirth Co Operative Housing Society  , Plot No 1, Sector 44 A, Seawoods, Navi Mumbai - 400706, Near Palm Beach Road",+(91)-022-27700800
Leelas Silktouch Beauty Par..,"Joshi Wadi-Shop No-2, Jawahar Nagar Road No-1, Goregaon West, Mumbai - 400104, Opposite Goregaon Railway Station.",+(91)-9892634998
Shine and Smile Salon,"Shop No.5/1 Satyam Prestige Plot No.14, Sector 4,, Karanjade, Navi Mumbai - 410206, Near Amul Ice-cream",+(91)-9595540054
Salon De Posh,"Plot  No 241, Jawahar Nagar, Aarya Samaj Road, Goregaon West, Mumbai - 400104, Behind I B Patel School",+(91)-9167329960
La Imagica Unisex Salon,"204 Shri Krishna Building Opposite Fun Cinema, New Link Road, Andheri West, Mumbai - 400053, Near Yash Raj Films Pvt Ltd (Corporate Office)",+(91)-8655337886
Ash Beauty World Spa Salon ..,"Shop No. 01 Ramanand Apartment Divagaon, Airoli Sector 9, Navi Mumbai - 400708, Near Vithal Mandir",+(91)-8356091378
Salon De Posh,"Plot  No 241, Jawahar Nagar, Aarya Samaj Road, Goregaon West, Mumbai - 400104, Behind I B Patel School",+(91)-9167329960
S - Dazzle Bollywood Make O..,"Shop No -2, Parshavmilan Building, Sector-11, Kamothe, navi mumbai - 410206, Opp. Sushma Patil School",+(91)-7400113709
Rich Feels Beauty Parlour,"Shop No  26/33  Kalpataru Complex, Old Agra Road, Shahapur, Thane - 421601, Near Dr.Ashish Patil",+(91)-7021710961
La Imagica Unisex Salon,"204 Shri Krishna Building Opposite Fun Cinema, New Link Road, Andheri West, Mumbai - 400053, Near Yash Raj Films Pvt Ltd (Corporate Office)",+(91)-8655337886
Silk Beauty Spa and Salon,"Shop No. 2, Mahalaxmi Nagar, Near Someshwar Mandir, Opp. Adesh Medical, Ambernath, Thane - 421501, Behind Budh Vihar",+(91)-8976484091
Shine and Smile Salon,"Shop No.5/1 Satyam Prestige Plot No.14, Sector 4,, Karanjade, Navi Mumbai - 410206, Near Amul Ice-cream",+(91)-9595540054
Eunoia Salon,"Shop No 96 EMP Building No 17, Thakur Village, Kandivali East, Mumbai - 400101, Near Fedral Bank",+(91)-9326029886
Sunitas Sparkle Beauty Salo..,"Shop No 4 Eden Kasturi Heights , Indralok Phase 6, Bhayandar East, Thane - 401105, Opp RBK Global School",+(91)-9768752395
Glory Ladies Beauty Parlour,"Shop No-24,Plot No-43,Soormalhar Apartment, Sector-36, Kamothe, Navi Mumbai - 410206, Near Masala Mantra Banquet Hall",+(91)-7666696081
Natashas Beauty Salon,"Shop No 1, Cerejo Apartment, Premier Road, Kurla West, Mumbai - 400070, Near Bank Of Baroda,Near Kohinoor City, Kamani Signal",+(91)-9821207611
Megha Jains Laser  Salon & ..,"1 , Jain Mention , Daftari Road ,, Near Samsung Shop, Malad East, Mumbai - 400097, Next to Doctor Oza Clinic",+(91)-9004662975
Freya Hair & Beauty Salon,"Shop No 2, A G Marg, Powai, Mumbai - 400076, Near Mahada",+(91)-9892404809
The Nail Diary,"D 101, Gold Crest 369, Next to ZUDIO, D-Mart Road, Virar West, Palghar - 401303, Near Dmart Shopping Center",+(91)-7020462698
Glamorous Ladies Beauty Spa,"Shop Number 50, Plot Number 4/5/6, Yeah Paradise, Sector 8 A, Airoli, Navi Mumbai - 400708, Near Apple Hospital",+(91)-9137361182
New Look Spa & Beauty Salon,"Nabula Darshan Bldg No.18 Shop No.10, Wayle Nagar Road, KHADAKPADA-KALYAN WEST, Thane - 421301, Opposite Aaijee Chemist",+(91)-9833489820
A 1 Beauty Parlour,"Building No.155 Room No.4759 Grd Floor, Oppsite Balgandharv Udyan, Vikhroli East, Mumbai - 400083",+(91)-9820826787
Thomas Hair and Beauty Salo..,"C/O Sun and Sand Hotel, Juhu Tara Road, Juhu, Mumbai - 400049, Next to Novetel Hotel",+(91)-22-26242988
Attitude Unisex Salon,"Shop No 01 Burhani Heritage, Mahatma Gandhi Road, Kandivali West, Mumbai - 400067, Opp Bori Masjid",+(91)-9930574048
Basil Salon and Spa,"K1 Juhu Supreme Shopping Center, Gulmohar Cross Road No 8, Juhu Circle-Juhu, Mumbai - 400049, Opposite Criti Care Hospital Behind Tiwari Sweets Shop",+(91)-7700950679
Yauvan Beauty Parlour,"Shop No.6, Radha Raman Apartment, Waman Rao Bhoir Road, Dahisar, Mumbai - 400068, Near Kandarpada Talab",+(91)-9869853322
Cut The Crap Unisex Saloon,"Shop Number 2, Ground Floor,Near Y5 Computer, Station Road, Ambernath, Thane - 421501, Opp. Dr. Bhise Hospital",+(91)-251-6566616
Evas Ladies Parlour and Mak..,"Shop No. 3, Shree Vijay CHS, Nityanand Marg, Near Chintamani Hall, Nityanand Marg, Panvel, Navi Mumbai - 410206, Near Chintamani Hall",+(91)-8850292541
Megha Jains Laser  Salon & ..,"1 , Jain Mention , Daftari Road ,, Near Samsung Shop, Malad East, Mumbai - 400097, Next to Doctor Oza Clinic",+(91)-9004662975
Stylish Lady Beauty Parlour,"61/507, Unnat Nagar Road Number 2, Goregaon West, Mumbai - 400062, Near Off S V Road, Unnat Nagar, Behind Nana Nani Park",+(91)-9820606918
Sparkle Beauty Salon,"101 Vijay Apartment, Juhu Lane, Andheri West, Mumbai - 400058, Oppsite BMW Showroom",+(91)-9819992113
La Imagica Unisex Salon,"204 Shri Krishna Building Opposite Fun Cinema, New Link Road, Andheri West, Mumbai - 400053, Near Yash Raj Films Pvt Ltd (Corporate Office)",+(91)-8655337886
Ritaz Unisex Salon,"Shop No.2, Ground Floor, Prakash Villa, Gurudwara Road, Santacruz West, Mumbai - 400054, Opposite Gurudwara",+(91)-9136707024
Blush Salon & Academy,"Shop No 6 , Raj Krupa Society, Bahind Kaju Wadi Bus Stop, Louis Wadi-Thane West, Mumbai - 400604, Near Sai Baba Mandir",+(91)-8879436728
Pramila Beautician,"Bldg No 5, B Wing, Matru Chaya Chs, Tilak Nagar, Mumbai - 400089, Near Sahakar Plaza Cinema & Opp Aamchi Shala",+(91)-9967540978
Flamboyance The Unisex Salo..,"Shop No 3 & 4, Maria Apartment, Nargis Dutt Road, Pali Hill-Bandra West, Mumbai - 400050, Opposite Indian Overseas Bank",+(91)-9870226116
Pramila Beautician,"Bldg No 5, B Wing, Matru Chaya Chs, Tilak Nagar, Mumbai - 400089, Near Sahakar Plaza Cinema & Opp Aamchi Shala",+(91)-9967540978
Nitins Salon Unisex,"Shop No.39, Bldg No. 15, Pokhran Road No.1, Samata Nagar-Thane West, Thane - 400606, Opposite Raymond Company",+(91)-9619577152
Haircom Unisex Saloon,"Ghansoli Village, Chinch Aali, Ghansoli, Navi Mumbai - 400701, Opposite Gavdevi Temple",+(91)-8652899009
La Imagica Unisex Salon,"204 Shri Krishna Building Opposite Fun Cinema, New Link Road, Andheri West, Mumbai - 400053, Near Yash Raj Films Pvt Ltd (Corporate Office)",+(91)-8655337886
Identify Family Parlour,"Shop No 42 Saraswati Building Vasant Nagar Complex, Kandivali East, Mumbai - 400101, Near Thakur Cinema",+(91)-9320820003
Hair Affair,"Shop No 17/18, Vasudev Sky High, Kanakia Road, Beverly Park-mira Road, Thane - 401107, Opposite Bhairav Residency Lane, Near Water Tank",+(91)-9819307530
Evas Ladies Parlour and Mak..,"Shop No. 3, Shree Vijay CHS, Nityanand Marg, Near Chintamani Hall, Nityanand Marg, Panvel, Navi Mumbai - 410206, Near Chintamani Hall",+(91)-8850292541
Pink Door Spa and Salon,"Hotel Crown Inn 1st Floor, Plot No 102/4, Panvel, Navi Mumbai - 410206, Next to Patil Hospital",+(91)-8949134773
Royal Unisex Salon,"Shop No 6, Ashish Chs Ltd, Mahakali Caves Road, Andheri East, Jijamata Road, Andheri East, Mumbai - 400093, Near Satya Sai Baba Mandir",+(91)-9768815720
New Light Beauty Salon,"219/ 23, Shop No 6,Versova Street, Bellasis Road, Mumbai Central, Mumbai - 400008, Nagpada Junction",+(91)-9967007734
Glamorous Ladies Beauty Spa,"Shop Number 50, Plot Number 4/5/6, Yeah Paradise, Sector 8 A, Airoli, Navi Mumbai - 400708, Near Apple Hospital",+(91)-9137361182
La Imagica Unisex Salon,"204 Shri Krishna Building Opposite Fun Cinema, New Link Road, Andheri West, Mumbai - 400053, Near Yash Raj Films Pvt Ltd (Corporate Office)",+(91)-8655337886
Unique Hair & Beauty Salon,"Premier Residences , Shop No.24 K Wing , Kohinoor City, Phase 1, Kirol Road, Premier Residencies, Kurla, Kurla West, Mumbai - 400070, Kohinoor City",+(91)-8454012239
Radical Beauty Salon and Ac..,"Shop No.G31,S.G.barve Marg,, Near Nehru Nagar Signal ,Kurla East,Mumbai 400024, Kurla East, Mumbai - 400024, Above SBI ATM",+(91)-7977928965
Shruti Wellness Center,"36 Teli Pada, Kanneri, Bhiwandi, Thane - 421302, Bank Of India, Opposite Payal Talkies",+(91)-7507481101
Green Imagee Hair & Beauty ..,"Shop No 5, Royal Apartment, Indralok, Bhayandar East, Thane - 401105, Opposite Tirupati Dream Building",+(91)-9930360096
Prince Bueaty Parlour & Cla..,"26,Dev Darshan Building, Kothkuwa Road, Malad East, Mumbai - 400097, Near Dhanjiwadi",+(91)-9892527031
Shweta Beauty Salon,"Harsh Vihar , Building No 31, Shop No 3, Sector 1, Near By Grasshopper, Shanti Nagar-mira Road, Thane - 401107, Opposite Shanti Shopping Center",+(91)-9923363961
Irfan Family Parlour,"Shop No.7, Turning Point Building, Vasant Nagari, Vasai East, Palghar - 401208, Near Vasant Nagari Circle",+(91)-7028696365
K Salon,"Unit No 26, Shop No 104, Orchid Mall, Mayur Nagar, Aarey Road, Goregaon East, Mumbai - 400065, Near Royal Palms",+(91)-22-28787159
Bharti Didis Beauty Parlour,"Ground Floor, Malati Bhuvan, RHB Road, Mulund West, Mumbai - 400080, Opposite Jalaram Dairy, Near Bavaji Ki Zhopdi Ashram",+(91)-9892271090
Mahhindras Swaroop Salon,"Plot No. 8, Swaroop Bunglow, Road No.2, Panvel, Navi Mumbai - 410206, Behind  Mohite Hospital, Sector 19,Opp. New Panvel Fire Bridge",+(91)-022-27455544
Glory Ladies Beauty Parlour,"Shop No-24,Plot No-43,Soormalhar Apartment, Sector-36, Kamothe, Navi Mumbai - 410206, Near Masala Mantra Banquet Hall",+(91)-7666696081
The Stylish Flow,"Shop No 3, Vijay House, Station  Road, Vikhroli West, Mumbai - 400079, Near Adhyayan Tutorial, Opposite Icici Bank",+(91)-8928916938
Reflection Beauty Salon,"Shop No- B7 , B Wing , Krushnakunj Society, Datta Chowk, Belawali Road, Badlapur, Thane - 421503, Near Apna Traders",+(91)-7058031911
Rekhas Beauty Salon,"Shop No 4/30, M G Road, Goregaon West, Mumbai - 400104, Near Ramdevs Baba Shop, Opposite Thakkar Dairy, Unnat Nagar",+(91)-9867251078
