Siya Salon And Academy,"Talati Co-operative Bldg , Room No. 2, Ram Mandir Road, Andheri West, Mumbai - 400061, Near God Gift Tower Next to Ram Mandir",07947203832
S K GUDDU SALON,"Shop No 38 Ground Floor ,303 Tijoriwal .,Building, Grant Road, Mumbai - 400007, Neat to Hotel Orient",+(91)-8779029476
Soul Unisex Salon,"PMC Bank Building, Lodha Heaven, Nilje, Thane - 421204, Near PMC Bank Building",+(91)-9326271145
Sun Set Salon,"Shop No-3, Angnel Apt., Ic Colony, Borivali West, Mumbai - 400092, Near-aster Building",+(91)-9833981127
Tanay Mens Parlour,"Shop No 1 Plot No 19, Saibaba Mandir Road, Turbhe, Navi Mumbai - 400703, Near Shiv Mandir",+(91)-9588109298
Shree Someshwara Gents Beau..,"Shop No -2, Garden View, Sector-19, Kopar Khairane, Navi Mumbai - 400709, near jimmy Tower",+(91)-7208659546
Annu Beauty Parlour,"1st floor, flat no. 12, jaya bhawan, near mahim railway station, Mahim, Mumbai - 400016, pitambar lane",+(91)-9967785551
Fame Mens Solon,"Ajanta Compound,Dhamankar Naka, Bhiwandi, Thane - 421302, Near Jain Mandir",+(91)-8806341941
