Violet Unisex Salon,"Shop No.4 Madhav Chambers No.1 Vetal Baba Chowk, Senapati Bapat Road, Gokhale Nagar, Pune - 411016, Next Rolls Mania",+(91)-8806261616
Butic College Beauty Parlou..,"Survey No 219, Eash Kripa, Tilak Road, Sadashiv Peth, Pune - 411030, Near Lokmanya Vachanalay",+(91)-20-24325487
Skin O Hair Salon,"Canriph Arcade Office No 10 1st Floor, M G Road, Camp, Pune - 411001, Nest To Mona Food Restaurant",+(91)-9822871456
Jack N Jo Salon,"Survey No 755/11 Mayur 11, Karve Road, Karve Road Kothrud, Pune - 411038, Near Peter England Showroom Above Bata Shop Karve Road Pune",+(91)-9822107807
Juice Salon & Nail Bar,"Sharda Apartment Ground Floor Opposite Gate 5, Aundh-pashan Link Road, Aundh, Pune - 411007, Near Abhimanshree Society",+(91)-7798414198
Trans Studios Unisex Salon ..,"Shop No 3 & 4, Baner Pashan Link Rd, Baner, Pune - 411045, Beside HDFC Bank",+(91)-20-65005050
Rodeo The Hair & Beauty Sal..,"West Block, Shop No 32-33, 1st Floor, Magarpatta Road, Hadapsar, Pune - 411028, OppositeThe Beer Cafe, Amanora Mall",+(91)-20-67277587
Amantra Spa And Salon,"Shop No  20 balewadi hight street, cummins building panchshil blgd, Balewadi-baner, Pune - 411045, Next to macD",+(91)-020-65803000
Jawed Habib HairXpreso,"Reliance Mart, Sr No 8 & 13, Downtown - The City Centre, Erandwane, Pune - 411004, Near Mhatre Bridge, Vakil Nagar",+(91)-8007055266
Dazzler Ladies Hair And Bea..,"Shop No 42 B Wing Gound Floor Shoppers Orbit, Vishrantwadi, Pune - 411015, Near Dominos Near Union Bank",+(91)-9881090311
VLCC Healthcare Ltd,"Shop No. 9, Bizzbay Mall, Undri NIBM Road, NIBM-Kondhwa Khurd, Pune - 411048, Opposite  State Bank Of India",+(91)-20-48610033
Marias Hair Dressing & Beau..,"Flat No 205 The Greens, North Main Rd, Koregaon Park, Pune - 411001",+(91)-20-26153749
Loris Unisex Salon,"Girme Health, Salunkhe Vihar, Pune - 411040, Near Wanowrie",+(91)-9657857080
Dolma Hair Dressing And Bea..,"1st Floor, Parmar Corner, Fatima Nagar-wanowrie, Pune - 411040, Fatima Nagar",+(91)-20-26861253
Salon Apple,"65/5/H, Salunke Vihar Road, Wanowrie, Pune - 411040, Above Garage Grill , Opposite.  Mathews Academy , Near Badhai Sweet ,Near ABC Farm",+(91)-9021512516
sweet salon & spa,"Sri Niwa, B Wing Flat No. B-2, IST Floor, Sangavi, Pune - 411027, Above Sai Mandir, Sai Chowk",+(91)-020-65349489
Salon Apple Beauty Hair Spa,"Shop No-15,, Sinhagad Road, Manik Baug, Pune - 411051, Opposite McDonalds, Near Nisarga Restaurant Chankya Nagar",+(91)-20-24357876
Sanis Unisex Salon,"Shop No 4, Shewale Towers, Pune Saswad Street, Fursungi, Pune - 412308, Above Monginis Cake Next to Bhekrai Nagar Jakat Naka",+(91)-9881222343
Sagar Mens Parlour,"Motiram Avenue Shop No 1, Nda Road, Bavdhan, Pune - 411021, Near Dominoz",+(91)-20-22953383
The Pearl Salon,"Taj Mahal Society,, Somnath Nagar-Vadgaon Sheri, Pune - 411014, Opposite Prasad Residency,  Behind Inorbit Mall ,",+(91)-9130488610
Kapils Salon,"Hypercity Kumar Pacific Mall Final Plot No  387 1st Floor, Shankar Sheth Road, Pune - 411037",+(91)-20-20396340
MZ Mangeshaz Salon And Acad..,"Rainbow Plaza, Shop No 03, Groung Floor, Pimple Saudagar-pimri Chinchwad, Pune - 411061, Near Mc Donald, Shiver Garden Chowk",+(91)-20-65320432
Delisha Spa & Beauty Touch,"Building No 8, Down German Baker Lane, Koregaon Park Rd, Vasani Nagar, Koregaon Park, Pune - 411001",+(91)-20-26052809
Gomati Beauty Clinic,"Flat No 6 Building No 1 Suvidha Apartments, Pune Nasik Road, Bhosari, Pune - 411039, Near Shiv Garage",+(91)-20-69330067
Big Bangs Theory Unisex Sal..,"Lower Ground Shop No 23 East Court Phoenix Market City, Viman Nagar, Pune - 411014",+(91)-20-66890733
La Belle Salon Bridal Studi..,"9, Chetna Apartments, Saifee Lane East Street, M G Road, Pune - 411001, Off M G Road Behind The Bata Showroom",+(91)-9970371714
Looks Salon (The Pavilion M..,"2nd Floor, The Pavilion Mall, Senapati Bapat Road, Pune - 411004, Near J W Marriott, Shivaji Nagar",+(91)-020-66421168
Evolve Series (Seasons Mall..,"Shop F/1/0 1st Floor Seasons Mall, Magarpatta City-hadapsar, Pune - 411028, Near Us Polo and VIP Showroom",+(91)-20-67220567
Solace The Salon,"Cosmos Housing Socitey, Plot No 401/B/12,7, Boat Club Road, Bund Garden Road, pune - 411001, Near HDFC Bank",+(91)-20-26162000
Ten On Ten Unisex Salon,"Shop No 5 Anand Terrace Building, Rambaug Colony Road, Kothrud, Pune - 411038, Near Hanuman Kirana Store",+(91)-9970005515
Blush Salon,"Shop No : 338 3rd Floor , E Square Xion Mall, Hinjawadi, Pune - 411057, Backside : D Mart",+(91)-7796659596
Habibs Hair and Beauty Salo..,"Vedas Center, Shop No 2, DP Road, Aundh, Pune - 411007, Near Shiv Sagar Veg Restaurant",+(91)-20-48617870
Badoda Mens Parlour,"157 Shop No 1/2 Satyam Apartments, Gultekdi Road, Mukund Nagar, Pune - 411037, Beside Ranka Hospital",+(91)-7447727080
Lizzes Aspen Spa (Jewel Squ..,"206 2nd Floor Jewel Square, Koregaon Park, Pune - 411001, Next to Taj Blue Diamond",+(91)-20-65009278
Excellence Hair Styling Sal..,"Flat No 206, Kundan Paradise, Bhau Patil Road, Bopodi, Pune - 411020, Near Pune IT Park,Nera Devi Orchid",+(91)-9890209867
Studio One Salon & Spa,"Basement Floor, Sterling Center, MG Road,East Street,, Camp, Pune - 411001, Opp Hotel Aurora Towers",+(91)-7030230815
Salon Apple Women,"26 B & C, First Floor, Sujay Garden, Vighahara Building, Mukund Nagar, Pune - 411037, Near Laxmi Narayan Theture",+(91)-20-29700726
Abhis Hair & Beauty Salon (..,"Premier Plaza Mall 1st Floor, Pimpri Midc, Pune - 411018, Near Big Ciema",+(91)-9860877613
Styvaana Unisex Fashion Sal..,"Office No 101, 1st Floor, Ikon Wallstreet 24, Mumbai Bangalore Highway, Warje, Pune - 411058, Above Mc Donald",+(91)-9370609628
Jawed Habib Hair Studio Bib..,"Survey No 569/2/4 Plot No  27/A, Bibvewadi Kondwa Road, Bibvewadi, Pune - 411037, Opposite Kalyan Bhel Dhavalgiri Co Operative Society",+(91)-7498307289
Waves Salon&academy,"Survey No 47/A, Bungalow No 6,1st Floor,Swayamsiddh Society, Kothrud, Paud Road, Pune - 411038, Opposite Bank Of Baroda,Near Sujata Mastani,",+(91)-8805888688
Persona Salon &Academy,"Payal Apartment 1St Floor, Airport Road,Vishrantwadi, Vishrantwadi, Pune - 411015, Behind Raj Motors",+(91)-9892155530
Tulips Unisex Salon,"203 Actual Court Building Second Floor, Gaikwad Nagar, Aundh, Pune - 411007, Above Reliance Fresh",+(91)-020-25883656
Nh Miracle Unisex Spalon,"Kohinoor Arcade Shop No.13 Tilak Chowk, Nigdi, Pune - 411044, Behind Pizza Hut",+(91)-020-27659441
Midas Salon For Men,"Agarwal Garden Shop No 1 Sector 25, Bhel Chowk, Nigdi, Pune - 411044, Near Area 44",+(91)-8983199100
House Of Bumble Salon By Sh..,"2nd Floor, Marriott Conference & Convention Centre, Senapati Bapat Road, Pune - 411004",+(91)-020-65003936
Richbit Salon,"Near Abs Gym, Magarpatta City Gymkhana, Magarpatta City-Hadapsar, Pune - 411028, Opp Pentagon 1",+(91)-7038563856
Jawed Habib Hair Studio Sal..,"Shop No  206 Level 2 , Vision One Mall, Pune Mumbai Highway, Chinchwad, Pune - 411033, Above Dominos",+(91)-20-69000076
Royal Touch Beauty Salon,"Blue Bells Appartment, Borhade Wadi, Pimprichinchwad, Moshi, Pune - 412105",+(91)-7888066654
Hairxpreso (Primrose Mall),"Survey No 77/1/1, Ground Floor, Primrose Mall, Baner Road, Baner, Pune - 411045, Near Datta Mandir Bus Stop",+(91)-9765800611
Sheries Salon & Institute,"Shop No 1-2 , Nyati Estate, Undri, Pune - 411060, Corinthian Club Road",+(91)-9960408608
Prostyle Salon (Xion Mall),"Shop No A2/01, Ground Floor, Xion Mall, Hinjawadi, Pune - 411057, Behind D Mart",+(91)-20-65241285
Jawed Habib Hair And Beauty,"Shop No. 5, GROUND FLOOR, Sky Max Mall,, Viman Nagar, Pune - 411014, Datta Mandir Chowk",+(91)-7666567725
Hair Studio,"Shop No. 74, A Wing, Spine Road, Moshi, Alandi - 412105, Near Spine City Mall",+(91)-9049388887
Koti Kutz,"Shop No.15 Celestino, Lohegaon Dhanori Rd., Dhanori, Pune - 411015, Opp. Shree Hans Garden, Near :- Canara Bank",+(91)-20-27028288
Kinnarrie Salon & Spa,"10th Floor Park Plaza Hotel 465, Ganesh Khind Road, Shivaji Nagar, Pune - 411005, Above Little Itlaly, Next To Central Mall 2",07947199426
Arsh Unisex Salon,"Shop No 6, Dhankude Corner, Bhusari Colony  Paud Road, Kothrud, Pune - 411038, Near PMT Depot",+(91)-7620005362
Hip Hair In Place,"Row House No 6, New Airport Road, Viman Nagar, Pune - 411014, Near Clover Corner Opposite Biodiversity Park",+(91)-8983011104
The Wedding Clinic,"Lane No 6 Bel Air Appartment 2nd Floor, Room No:- 12, North Main Road, Koregaon Park, Pune - 411001, Near Arthers Theme",+(91)-9172324455
Habibs Hair And Beauty Salo..,"Shop No -4, Ganga Samruddhi, Bibewadi Kondhwa Road, Market Yard, Pune - 411037, Opp Gangadham Phase 2",+(91)-9151660660
Syalvania Ladies Beauty Sal..,"Dombi Wadi, Bt Kawade Road, Ghorpuri, Pune - 411001",+(91)-9923427146
Salon Apple,"Flat No.2 Swojas Gulmohar Apartment, Law College Road, Erandwane, Pune - 411004, Opposite Tata Motors  and CCD",+(91)-7350797901
M Kay Skin And Hair Salon,"101 Shree Vidyanand Society, Ketkar Road, Prabhat Road, Pune - 411004, Near Kalmadi School",07947199950
Styles N Smiles Unisex Salo..,"Shop No 1 Radha Krushna Society, Paud Road, Kothrud, Pune - 411038, Near Rambaug Colony Near Hotel Palavi",+(91)-9028083096
Habibs Hair & Beauty Salon,"Shop No. 07, Warje Naka Road, Karve Nagar-Hingne Budrukh, Pune - 411052, Opp. Kakdde City",+(91)-9673470960
Beyond Beauty Salon & Spa,"Pebbles Society, Bavdhan, Pune - 411021, Patil Nagar, Opposite DSK Ranwara Beside Surya Datta Collage",+(91)-8805803648
V Lounge Unisex Salon,"Shop No 1, West Wing, Aurora Tower, M G Road, Camp, Pune - 411001, Near Union Bank Of India",+(91)-9923166580
Papillon Beauty Salon For L..,"sr no 18/2 bharatkunj soc no 1, ganesh nagar, Paud Phata-Kothrud, Pune - 411038",+(91)-020-25456945
Make Over Family Salon,"Sonali Appartment, Shop No. 3, Visharant Wadi, Airport Road, Pune - 411015, Near Kirti Hotel",+(91)-9892155530
Lucky Star Insperation Hair..,"Showroom No 1B , Vaskon Chambers, Viman Nagar, Pune - 411014, Opp Hyatt Hotel",+(91)-20-65343454
Aromathai Day Spa (Phoenix ..,"F67, 1st Floor, Survey No 207, Phoenix Market City Mall, Viman Nagar, Pune - 411014, Nagar Road",+(91)-20-66890425
Slice N Bounce Salon And Sp..,"216 Victoria 2 Fortaleza, Kalyani Nagar, Pune - 411014, Opposite Gold Adlabs Above Koutons Showroom",
Wisteria Studio,"Ground, Gokhale Nagar, Pune - 411016, Near Tukaram Ombale",+(91)-9552006917
Jawed Hair Studio & Beauty,"Sr.No.183 Vrindavan Arcade, Mundhawa Road, Hadapsar, Pune - 411028, Near Amanora Town Centre",+(91)-9922512782
Tulip Wellness Spa,"Sahas Building, Shop No 3, Nagar Road, Chandan Nagar-kharadi, Pune - 411014, Above Manappuram Gold Loan Opposite Chandan Nagar BRT Bus Stop",+(91)-9545891408
Kenchi Salon,"25, Ashwini Palace,, Next to Kedari Petrop Pump, Wanowrie, Pune - 411040",+(91)-8421786063
Hers and His Salon,"Shop No 20/21, Riddhi Enclave, Viman Nagar, Pune - 411014, Near Ganpati Chowk",+(91)-20-40035228
Taowui Ladies Beauty Salons,"Shop No 10 Ground Floor East Street Galleria, East Street, Camp, Pune - 411001, Near SBI Bank Near East Street Post Office Building",+(91)-20-66019521
Sea  & Pearl Beauty Salon &..,"Magarpatta City-hadapsar, Pune - 411028, Oppo Seasons Mall",+(91)-7507712279
Madhuri Sawant,"1st Floor La Ventena, Nibm-kondhwa Khurd, Pune - 411048, Opposite Sun Shree E 4 Above Coffee Jar Near RIMS International School",+(91)-020-65331114
Suonmoi Beauty Salon,"Survey No 1154 Prime Arcade, Saifee Lane, Camp, Pune - 411001, Next to Videocon Library",+(91)-20-26343061
The Hair Diaries,"A Wing Hermes Vishal, Lane 7, Koregaon Park, Pune - 411001",+(91)-8600888999
Royal Hair And Beauty Saloo..,"Plot No. 536 Sector 27 , Manohar Villa, Akurdi Pradhikaran Road, Pradhikaran, Pune - 411044, Near Sambhaji Chowk",+(91)-9561450239
Senaj Salon And Spa Private..,"Shop No 9 B 1st Floor West Block,Amnorna Mall, Magarpatta Road, Amanora Park Town, Pune - 411028",+(91)-020-67272223
Supreme Mens Parlour,"Shop No. 3, Off. S.B Road, Patarkar Nagar Road, Gokhale Nagar, Pune - 411016, Opp. Sheti Mahamandal",+(91)-8888303616
Aanaya Thai Spa N Salon,"Pawani Pride Apartment, Ravet, Pune - 412101, Near Sbi Bank Back Of Prathamesh Wines",+(91)-9423133366
Fine Cut Salon,"Shop No 6 Konark Park, Dhole Patil Road, Bund Garden, Pune - 411001, Opposite Gera Chamber",+(91)-20-26166688
Lucky Star Hair Salon,"Shop No 2 A Amrut Park, Nagar Road, Kalyani Nagar, Pune - 411014, Cake Shop Near",+(91)-20-26686712
Sanskrutas Beauty Studio an..,"Yashraj Complex, Mehendale Garage Road, Erandwane, Pune - 411004, Near Deenanath Mangeshkar Hospital",+(91)-20-25430925
Shridha Healing Spa And Sal..,"Unit B 5 ,31/A 31/1B, Plot No. 323, Ashiyana Park Society, North Main Road, Sangamwadi Road, Koregaon Park, Pune - 411001, Near Seva Vikas Bank",+(91)-020-69701113
Cologne Spa & Salon,"Vidyuts Nagar Society, Lane Number 6, Koregaon Park, Pune - 411001, Near Lane Number 6 End Point",+(91)-9545109116
Gmh Unisex Salon,"Shop No. 06, PL No. 41, Sainik Nagar, Clove Park, Viman Nagar, Pune - 411014, Gera Enclave",+(91)-9325549682
Hakims Aalim Hair N Beauty ..,"Shop Hum 4, N Avenue Road, 2, 10 North Building,, Kalyani Nagar-Yerawada, Pune - 411006, Near The Irani Cafe",+(91)-8421157449
Lucky Star Salon (Cru Mall),"L/11 Cru Mall, Gangadham Road, Next to Defence Colony, Bibvewadi, Pune - 411037, Opp Gagan Vihar",+(91)-20-26113083
Miracle Touch Unisex Salon,"Flat No 302 Ragvillash Society A 59, Lane C, Koregaon Park, Pune - 411001",+(91)-020-66491468
Crystal Shine Beauty Salon ..,"Shop No 1,Onkar Park, Ganpati Chowk, Vishal Nagar, Jagtap Dairy, Pune - 411027",+(91)-9373300863
Cut and Style,"Shop No.5 Ganga Constella  Society, Kharadi, Pune - 411014, Near Ganga Constalla Near Eon",+(91)-8669656851
Laura Unisex Hair Salon,"34/2, Tanaje Nagar, Mohan Nagar, Chandrabhaga Nagar Road, Dhankawadi, Pune - 411043",+(91)-8796551314
Lirit Family Beauty Salon,"Shop Number 3, Vadgaon Sheri, Pune - 411014, Prasad Nagar Near Siddhivinayak Temple",+(91)-9921766848
Javed,"Plot No 188, Talegaon Dabhade, Pune - 410506, Near Yashwant Nagar ,Near Dominos Pizza",+(91)-2114-227000
Impression Hair Beauty Salo..,"Fergussion College Road Next Lane Off Fergussion College Gate No 2, Shivaji Nagar, Pune - 411005, Behind Deendayal Hospital, Above Tileskart Showroom Opposite to Talwarkar Gym",+(91)-20-25650051
Jawed Habib HairXpreso (Pho..,"F-56, 2nd Floor, Pune Nagar Road, Viman Nagar, Pune - 411014",+(91)-9552660660
Toni & Guy Essensuals Salon,"Store No 2, Tower No 2, World Trade Centre, Fountain Road, Kharadi, Pune - 411014, Near EON IT Park",+(91)-9346600600
Try Me Mens Parlor,"Plot No.652, Shop No.2, Ground Floor, Tarun Maharashtra Society, Padmavati, Pune - 411009, Near Sahakar Nagar Police Station,",+(91)-7840904013
Zulf Salon And Academy,"Shop No 3 C 4 Natasha Enclave Building, Nibm Road, Nibm-Kondhwa Khurd, Pune - 411048, Opposite ICC Cable Opposite Nibm Post Office",07947200038
Richbit Salon (Cru Mall),"Shop No -4,5,6,7, Ground Floor, Ravi Raj CRU Mall, Kondhwa Lulla Nagar Road, Bibvewadi, Pune - 411037, Next to Federal Bank, Gangadham Chowk",+(91)-9764345176
Sonis  Hair Spa & Beauty St..,"Shop No 5 Rose Garden Soc, Konark Campas Road, Viman Nagar, Pune - 411014, Near Planet Medical",+(91)-9890414982
Milan hair cutting salon,"714, Budhwar Peth, Pune - 411002, Nr sakal press",+(91)-8485040211
Shape & Glow,"201 SAI APEX, Viman Nagar, Pune - 411014, Dutta Temple Chowk",
Habibs Hair And Beauty Salo..,"1540/41, 1st Floor, Astavinayak Appartment, Tilak Road, Sadashiv Peth, Pune - 411030, Near Maharashtra Eletronics Showroom",+(91)-8237660660
Creative Arts,"Plot No 78, Gokhale Nagar, Pune - 411016",+(91)-8888978678
Ideal Salon,"Amar Business Bay Shop No 2, F C ROAD, Deccan Gymkhana, Pune - 411004, Opposite Wadeshwar Restaurant",+(91)-9822332294
Briller Unisex Salon,"1st Floor Pradnya Empire, Shivaji Nagar, Pune - 411005, Near Deep Bunglow Chowk",+(91)-020-48613399
Apple Unisex Salon,"30/1 Sai Ganesh Complex, Karve Nagar Road, Karve Nagar-hingne Budrukh, Pune - 411052, Near Sahwas Corner",+(91)-9503498009
Sanskrutas Beauty Studio,"Ramchandra Apartment, Shirole Road, Shivaji Nagar, Pune - 411005, Behind Tata Capital, Near Pmc Pay & Park, Off F C Road",+(91)-20-25537363
Richbit Salon,"Sai Heritage Shop No B9, Aund Baner Link Road, Aundh, Pune - 411007, Sai Heritage",+(91)-8767070703
Grace Beauty Parlour,"A 1 Neelay Apartments, Fatima nagar road, Fatima Nagar-Wanowrie, Pune - 411040, Near bakery",+(91)-20-26861235
C3 Unisex Beauty Salon,"Shop No 15, Kumar Corner, Convent Street, Camp, Pune - 411001, Close to Shivaji Market N Choksy School Nr Sharad Stores",+(91)-020-64012600
Totally Twisted,"1103, A/14, Gurukrupa Bungalow,First Floor, Lakaki Road, Shivaji Nagar Model Colony, Pune - 411016, Opp Vidya Bhavan School Main Gate",+(91)-20-25650268
Guys &girls Unisex Saloon,"Shop No 57, Ground Floor, Vision9 Mall, Kunal Icon Road, Pimple Saudagar, Pune - 411027, Near Saudagar Restaurant",07947204176
Ideal Hair Salon & Cosmetic..,"67/A, Range Hills Road, Ashok Nagar, Pune - 411007, Near Symphony Hotel Ashok Nagar",+(91)-9850022121
The Ideal Salon,"Ashok Sankul 2, Rangils Road, Shivaji Nagar, Pune - 411005, Near Bhosale Nagar",+(91)-9850022121
Madonna Ladies Beauty Salon,"Shop No 10 Mira Society, Shankarshet Road, Shankar Sheth Road, Pune - 411037",+(91)-20-26445152
Dost Hyat Salon,"Shop No 1, Sunshree Suntech, Nibm Road, Nibm-kondhwa Khurd, Pune - 411048, Near Rose Parade Society",+(91)-20-26855596
Hair Bar The Salon,"Corniche Tower,  1st Floor, Lane 2A, Kalyani Nagar-Yerawada, Pune - 411006, Opposite A. R Suites Fontana Bay",+(91)-20-26656269
GMH unisex salon,"Gmh Unisex Salon Gera Enclave, Sainik Nagar, Clover Park, Viman Nagar, Pune - 411014, Viman Nagar",+(91)-9890398743
The Nature Spa,"Shivaji Co Operative Housing Society, Bhageerath, Gokhalenagar, Pune, Senapati Bapat Road, Pune - 411016, Behind JW Marriott",+(91)-7058010666
Caressaa Day Spa,"B 9 Ashiyana Park, North Main Road, Koregaon Park, Pune - 411001, Opposite Fiat Showroom",+(91)-8380086214
Apple Next Salon,"Shop No 02 Guru Ganesh Nagar Kothud, Pune, Kothrud, Pune - 411038, Ashish Garden",+(91)-7387394499
Rashmis Chalet Beauty Salon..,"Shop No. 6,7, 8 & 9, Lunkad Dreamland, Viman Nagar, Viman Nagar, Viman Nagar, Pune - 411014, Near Telephone Exchange",+(91)-9822050012
Pet Inn Salon,"B 1 Ashiyana Park, North Main Road, Koregaon Park, Pune - 411001, Opposite Pizza Hut",07947196550
Sai Gents Parlour,"Clarion Park, Aundh, Pune - 411007, Near Gaikwad Chowk,Near Gaikwad Petrol Pump",+(91)-9158481212
Studio Strands A Unisex Sal..,"1st Floor Jewel Towers, Lane No -5, Koregaon Park, Pune - 411001, Opposite Natures Basket",+(91)-020-26155808
Anex Mens Parlour,"Shop No 88/727 Shivani Building, Shahu College Road, Parvati, Pune - 411009, Laxmi Nagar, Near Gajanan Maharaj Mandir",+(91)-9765554810
Royal 19 Thai Spa,"Sr no 587, vastushree, office no -7, Market yard road, Market Yard, Pune - 411037, Gultekdi,near Vinayak hospital",+(91)-020-24264019
S & W Unisex Salon,"F Residency Shop No F-11, Chhatrapati Shivaji Maharaj Garden, Vadgaon Sheri, Pune - 411014, Near Brahmasuncity",+(91)-8888880718
V Lounge Unisex Salon,"Town Square Shopping Centre, Shop No B 15, New Airport Road, Viman Nagar, Pune - 411014, Near Dorbji Mall",+(91)-8796175475
Hair Xpress And Beauty Salo..,"Shop No 2 Arya Building Guruprasad Colony, Cummins Collage Road  Lane No 01, Karve Nagar-hingne Budrukh, Pune - 411052, Rudra Hotel Near Soda Shop Navsahydri",+(91)-9921246669
Lavanya Beauty Parlour,"Office No 3 Building A10 Vishnu Vihar, Bibvewadi Kondhwa Road, Bibvewadi, Pune - 411037, Near Kumar Park Pune",+(91)-9225542433
Guts Family Salon,"Shop No. 4, Crown Plaza, Nibm  Road, Undri, Pune - 411060, Near T.R Wines",+(91)-9767569708
Kohinoor Mens Parlour,"Shop No-08 Sadguru Angan Mahesh Society, Bibvewadi, Pune - 411037, Nr Pushpm Gas Godown",+(91)-7276734093
Finesse Spa And Salon,"Flat No 8, 1st Floor Krishnai Building  A Wing, Aundh, Pune - 411007, Near Parihar Chowk, Next to Monginis",+(91)-9730667127
Shrungar Hair And Beauty Sa..,"Shop No A 36 Sector No 09, Bhosari Industrial Estate, Pune - 411026, Spine City Mall",+(91)-9822048358
Grace Beauty Salon Kondhwa,"Kubera Park Shop No 4, Kondhwa Road, Kondhwa Khurd, Pune - 411048, Near Shee Chinese Restaurant",+(91)-20-26830409
Ms-Nisha Pande,"Business Guild, 1st Floor, Law College Road, Erandwane, Pune - 411004, Opposite Barista Cafe",+(91)-8975756812
Salon Apple Womens,"Shop No 13/14 Ruturang Society, Sahakar Nagar-Parvati Darshan, Pune - 411009, Near Yes Bank Opp City Light Bakery",+(91)-8237040091
Eleganz Salon,"Shop No 3 ,Auram Bulding, Vimanagar Road, Viman Nagar, Pune - 411014, Near Hindustan Hotel",+(91)-8483839241
Toni And Guy Essensuals Sal..,"2nd Floor, Seasons Mall, Magarpatta City-hadapsar, Pune - 411028, Near Cinepolis Cinema",+(91)-020-67234600
Body & Soul,"Sacred World Mall 2 ND  Floor South Block, Wanowrie, Pune - 411040, Jagtap Chowk Above Mcdonalds",+(91)-020-41032345
Cherrin Beauty Salon,"Shop No. 103, Purple Plaza, Lake Town Road, Bibvewadi, Pune - 411037, Opp SBI Colony",+(91)-9011038551
Ozone Plus Unisex Saloon An..,"Near Ram Krushna Mangal Karyalay, 60 Feet Road, Pimple Gurav, Pune - 411061, /near Devkar Park",+(91)-9921010007
Sai Hair Salon,"Old Mumbai Pune Hwy, Baluchi Vasti, Shivaji Nagar, Pune - 411005",
Sanman Hair Dressers,"1215/1, Fergusson College Road, Deccan Gymkhana, Pune - 411004",+(91)-20-25530113
Attitude Hair Dresser Saloo..,"Shop No 1, Survey No 10, By Pass Road, Kondhwa Khurd, Pune - 411048, Near Welcome Hall , Op Suzuki Showroom",+(91)-9421786767
Salon Apple,"Gangadham Shatrunjay Road, Kondhwa Budruk, Pune - 411048, Near Modern Electronics",+(91)-8623922424
Salon De Dilip,"Shop No 13 and 14 Green Park Apartment, Pune Satara Road, Katraj, Pune - 411046, Opposite Bharti Vidyapeeth Main Gate",+(91)-020-24375343
Smart Look Premium Salon,"Shop No 1, Ram Krushna Plaza, Siddheshwar Nagar, Vishrantwadi, Pune - 411015, Opposite to IDBI Bank",+(91)-8482811698
Aqua Unisex Slimming Beauty..,"Shop No 8, Bizz Bay, Undri Road, NIBM-Kondhwa Khurd, Pune - 411048, Opp Clover Hill",+(91)-020-41230505
Salon Apple Bridal Makeup A..,"Shop No. 31/32 Parmar Pawan, Near Jyoti Restaurant, Nibm-kondhwa Khurd, Pune - 411048, Near Dominoz Pizza",+(91)-9910823236
Salon Apple,"2165 Flat No.2 Vivek Building, Sadashiv Peth, Pune - 411030, Behind Sanas Ground Near Kalpana Hotel",+(91)-7756005060
Hair Craft Unisex Salon,"Vandan Plaza,Akash Ganga Society, Pimple Saudagar, Pune - 411027, Near Konkane Chowk,Near Smoking Joes Pizza",+(91)-8446227071
Lizzes Hair Dress & Beautic..,"Le Meridian Hotel, Rbm Road, Pune Station, Pune - 411001",+(91)-20-66044114
Beautyzone Salon,"Anubhav Society, Rambaug Colony, Kothrud, Pune - 411038",+(91)-7083110011
Serenity Salon Spa,"Shop No. 110  Ist Floor Sai Crystal Mall, Vishal Nagar Road, Vishal Nagar-pimple Nilakh, Pune - 411027, Beside HDFC Bank,Near Wakad Phata",+(91)-8390700050
Grace Mens Salon,"Shop No -2 Fame Manor, Salunke Vihar Road, Salunkhe Vihar, Pune - 411040, Near Badhai Sweets",+(91)-9850646577
The Royal Spa And Salon,"Flat No 1 Spring Field, Kharadi, Pune - 411014, Opposite to Reliance Mart",+(91)-020-69337337
Schon Unisex Salon & Spa Ac..,"1 Floor, Above TJSB Bank , Below Talwalkars Gym, Kothrud, Pune - 411038, Near Karve Statue",+(91)-8623810033
K K Unisex Salon,"Akshay Center Shop No 14, Dange Chowk Road, Thergaon, Pune - 411033, Near MacDonald",+(91)-7397828848
Marias Hair Dressing & Beau..,"Shop No 1 & 2, Anusuya Enclave, Wanowrie, Pune - 411040, Near Jagtap Chowk, Next to French Wines",+(91)-020-65614842
Look Young Salon,"Pride World City. Shop60 Town Plazza Beside Dy Patil Collade Charavali, Dhanori, Pune - 411015",+(91)-9834347501
Shravan Unisex Salons,"Sadguru Angan Shop No-7 Mahesh Society, Bibvewadi, Pune - 411037, Near Gas Gowdown",+(91)-8421828316
The Looks Unisex Saloon,"Sr No - 30/1, Pune Satara Road, Dhankawadi, Pune - 411043, Opp Akshay Hotel",+(91)-9822850846
Nails And More,"A2 Vidyut Nagar Co-Operative Housing Society, South Main Road, Koregaon Park, Koregaon Park, Pune - 411001, Near Diagonally Opposite Terttulia",+(91)-9075797066
Amantra Spa & Salon,"Shop No 20, Cummins Panchshil Biulding,  Highstreet , , Laxman Nagar, Cummins India Office Road, Balewadi-Baner, Pune - 411045",+(91)-9011993300
Viva Beauty Clinic & Traini..,"Shop No 48 Ground Floor Ashok Vijay Complex, Mahatma Gandhi Road, Camp, Pune - 411001, Near Aurora Towers",+(91)-9822098522
Shivdeep Beauty & Spa,"Sr No 28/1/A Shop No 1, Ridhikunj, Sasane Nagar-Hadapsar, Pune - 411028, Opposite Shivaji Rao Bhosale Bank Near By Jan Seva Bank",+(91)-9881944039
Frangipani Unisex Salon & S..,"Shop No 6 Bizz Bay Mall, Nibm Undri Road, Nibm-kondhwa Khurd, Pune - 411048, Opposite Clover Hill",+(91)-20-66206973
Senses Salon And Spa,"Yashaswi House Lane -15, Prabhat Road, Prabhat Road, Pune - 411004, Near Symbiosis School",+(91)-9325981870
Splash Ladies And Salon,"Shop No 15 Saikar Complex, Wakad, Pune - 411057, Near Ginger Hotel, Next To Axis Bank Atm Bhumakar Chowk",+(91)-7447659873
Fahrenheit Salon,"Gold Plaza 2nd Flr, Kharadi Bypass Rd, Kharadi, Pune - 411014, Above Dominos Pizza Near Premier Inn",+(91)-8805836255
Salon d3,"Aleeshan Society, Bhandarkar Rd, Bhandarkar Road, Pune - 411004, Opp skoda showroom",+(91)-9970969690
Mks Milagro,"Aadarsh Colony  Banglow No 13, Lane No 10, Tingare Nagar, Pune - 411032, Near Kondeshwar Gurudwara",+(91)-9766385041
New Vivek Hair Stylist,"Shop No.20, Aditya Nakoda Enclave, Sinhgad Road, Jaydeo Nagar-Dattawadi, Pune - 411030, Opp P L Deshpande Garden",+(91)-020-24332244
