Apana Masale,"A/P Kaledhon, Vita Mayani Road, Pune City, Pune - 411002, Near Bank Of India",07947208543
New Sakhi Enterprises,"Survey No. 22/5/1,, Tuljai Colony No. 2, Thergaon, Pune - 411033, Near Sancheti School",+(91)-9922379795
Swanand Shatau,"Pune Nashik Highway, Narayangaon Ho, Narayangaon - 410504, Oppsite Mauli Misal House",07947315510
SRI BANNARI FOODS,"50, Shivaji Nagar CHS, Opp Swastik Chambur, Chembur East, Navi Mumbai - 400071, Dana Market APMC",07947219643
Ashwini Enterprises,"Maa Durga Seva Society, Wadi Lal Gosalia Road, Kandivali West, Mumbai - 400067, Sanjay Nagar, Near Ekta Nagar",07947182461
Jijai Masale,"Goleshwar Road, Karad, Karad - 415110, Backside Siddharth Magal Karyalay",+(91)-9767116406
A P Patil Trading Company,"Plot No 255, Lane No 3, Marketyard Sangli, Sangli - 416416, APMC",+(91)-9209197711
Shivam Traders,"Plot No 40, 1st Lane, Marketyard Sangli, Sangli - 416416, Vasant Market Yard",+(91)-0233-2670319
Aishwarya Kolhapuri Masale,"Vivekanand College Road, Nagala Park, Kolhapur - 416003, Near Vivekanand College",07947078340
Appa Organic Edible Oil,"Pune Banglore Highway, Kalamwadi, Sangli - 415406, Near Devraj Hotel",07947365201
Indu Masale,"Building Name -  Mayfair   Shop No - 50 Opp  Khinwasara, Ulka Nagari, Ulkanagari, Aurangabad-Maharashtra - 431001, Khinwasara Woods",07947367028
R N Foods,"229/2A Ravisona Complex, Madhavnagar Road, Marketyard Sangli, Sangli - 416416, Behind Patilwada Hotel",+(91)-9130254361
A1 Rajesh Masale,"1318,  C Ward, Laxmipuri, Kolhapur - 416002, Near Sabji Mandai",+(91)-0231-2644725
Amrut Organic Products,"Bahane Plot , Sangli Nandre Road, Nandre, Nandre, Sangli - 416416, Behind Of Samrat Kadabakutti",+(91)-7038045895
Manglam Home Products,"Cotton Market Chowk, Dhamangaon Road, Yavatmal Ho, Yavatmal - 445001, Near Ganpati Mandir",+(91)-07232-243064
Agrivyapar,"Neemuch Road, Nai Abaadi, Mandsaur - 458001, Near Krashi Upaj Mandi",07947440865
Aarvi Exports,"54 and 55 Kanhaiya Nagar, Jodhpur Ho, Jodhpur - 342001, Near Sbi Bank Shikargarh",07947064416
Tirupati Spices,"Jaipur Golden, Gulab Badi, Rampura, Kota-Rajasthan - 324001, Behind Traffic Police Office Gulab Bari",+(91)-8619657030
Www.cooksvilla.com,"Plot No 150, 151, Mandore Rd, Maheshwari Colony, Mandore Road, Jodhpur - 342006, Near By Krishi Mandi",+(91)-7665576650
Balaaji Trading Coy And Btc..,"No 132/5, Block 8 BTC Mills, Sivathapuram, Salem - 636307, Near Kattur",+(91)-0427-2480938
Jiyanshi Rajasthani Foods,"Mata Ji Ka Mandir, Osian, Jodhpur - 342303",07947170973
Mithran Exports,"No 1 New, Pethanachiyamman 1 St Street, Villapuram, Madurai - 625012, Near By Koodakovil School",07947266604
Anu Foods Appalam Manufactu..,"No 3298, Tnhb Colony West Anuppanady, Anuppanady, Madurai - 625009, Near Palayampatti Nadar Higher Secondary School",+(91)-9894457999
Kohiinoor Mills,"Shahabaug, Puna Mahabaleshwar Road, Wai, Satara - 412803, Near Shahabaug",07947316798
Bharati Products,"414, Siddhanath Society, Shivaji Chowk, Bhiwandi, Bhiwandi - 421302, Near Sai Mandir",07947331991
Shri Samarth Enterprises an..,"College Road, Gokul Colony, Rahuri, Ahmednagar - 413705, Near Bhagarathibai Vidyalay",+(91)-9096405808
Sadguru Masale And Dryfruit..,"Sry No -78 /3 , Plot No-19, Row House No-1, Vasantnagar, Khed, Khed Wadhe, Satara - 415003",07947317238
Janta Supreme Punjabi Atta,"Sardar Nagar No 3,, Hemant Manjrekar Marg, Sion Koliwada, Mumbai - 400022, Samaj Mandir Hall",07947168409
Apana Masale,"A/p Kaledhon, Vita Mayani Road, Kaledhon Satara, Satara - 415312, Near Bank Of India",07947317286
A Amratlal & Co,"Building No 406, Ebrahim Rahemtulla Raod, Pydhonie, Mumbai - 400003, Oppo- Pydhoni Police Station",+(91)-022-23461548
Ambica Enterprises,"Shop No. 7, Parag Plaza, Nagar Manmad Road, Savedi, Ahmednagar - 414003, Patrakr Chowk",+(91)-9819321232
Shraddha Masala,"Shop 2/A , Dwarka Bhai Niwas,, Dahanukar Wadi,Bunder Pakhadi, Kandivali West, Mumbai - 400067, Near Link Road",07947174690
Shree Ganesh Traders,"Shop Number 5 Sita Nagar, Dumping Road, Mulund West, Mumbai - 400080, Opposite BMC Godown",+(91)-8879112454
Asuvara Masalewale,"Plot No M 28, Satara MIDC, Satara - 415004, Additional MIDC, Back Side Of Top Gear Company",07947316374
Shree Ram Trading Company,"Plot No 14, Market Yard, Pune Bangalore Highway, Umbraj, Karad - 415109",+(91)-2164-264612
Naeem Masala,"Shop No 23 and 24, Mirza Ghalib Market, Matka Gali, Null Bazar, Mumbai - 400003, Near Gol Deval Temple",+(91)-9029377451
Pravinam Traders,"Mansukh Building, Chitale Road, Dilli Gate, Ahmednagar - 414003, Near Dena Bank",+(91)-241-2551112
Amrutlal Bhurabhai Co,"Ground Floor, Anand Bhuvan Building, 17 Babu Genu Road, Princess Street, Mumbai - 400002, Near Union Bank Of India & Behind Lohar Chawl, Dawa Bazaar",+(91)-022-22191111
Amrut Industrial Products,"Chemical House, L B Shastri Marg, Gokul Nagar-Thane West, Thane - 400601, Next to Vardhaman Industrial Estate & Near Navneet Motors",+(91)-022-21722271
G M Masale,"Hospital Road, Manerajuri, Sangli - 416408, Government Hospital",07947230575
Pandya & Sons,"Vasant Market Yard, Shop No 311, 1st Lane, Sangli HO, Sangli - 416416, Market Yard",07947364638
Swad Masale,"Main Road, Palus, Sangli - 416310, Near Sangram Bhavan",07947177044
Girnar Industries,"Sai Datta Complex, 100 Ft Road, Sangli - 416416, Near D Mart",07947271019
Deep Traders,"Juna Mondha, Aurangabad Ho, Aurangabad-Maharashtra - 431001",07947366119
Nakshatra Gruha Udyog,"263 E Ward Chaitanya Appartment, Main Road, Tarabai Park, Kolhapur - 416003, Behind Waman Hari Pethe Jewellers",07947250682
Sajan Agencies,"Sajan Chambers, Anguri Bagh Road, Aurangabad HO, Aurangabad-Maharashtra - 431001, Behind Maratha High School",+(91)-9423955555
Orggi Fresh,"C.S No.23/6/7,E, Kusum Heritage, Tarabai Park, Kolhapur - 416003, Opposite Pitali Ganpati Road",07947470662
Apana Masale,"A P Kaledhon, Vita Mayani Road, Omerga Osmanabad, Osmanabad - 413606, Near Bank Of India",07947321159
Shree Mahalaxmi Traders,"556/557 E Suresh Complex, Vyapari Peth, Shahupuri, Kolhapur - 416001, Near RBL Bank",+(91)-0231-2653376
Belokar Spices,"Annapurna Gruh Udyog, Aarnav Heights, Flat No  05, Dhruva Nagar, Gangapur Road, Nashik - 422013, Near Motiwala Collage",+(91)-9096000221
Apana Masale,"AP Kaledhon, Vita Mayani Road, Bijapur Railway Station, Bijapur-Karnataka - 586104, Near Bank Of India",07947346129
Prism Agencies,"Galaxy Park Apartment, Vapi Daman Road, Chala, Vapi - 396191, Near HDFC Bank, Opposite Parvarish Children Hospital",+(91)-7676768761
Bhakalo Fruits and Vegetabl..,"16 Sahyadri Shopping Centre, Solapur Ho, Solapur - 413001, Near Old Employment Chowk ,Beside Kamat Hotel",07947466684
Apana Masale,"A P Kaledhon, Vita Mayani Road, Solapur City, Solapur - 413007, Near Bank Of India",07947364218
Sartaj Trading Co. Kirana,"Near Police Chowki Chelipura, Chelipura, Aurangabad-Maharashtra - 431001, Opp Easy Dental",+(91)-9823093264
Shivanjali Food Products,"Shivanjali Food Products, Haydrabad Road Ghungrala, Ghungarala, Nanded - 431709, Near Bus Stop Ghungrala",08045795682
Apana Masale,"Ap Kaledhon, Vita Mayani Road, Bagalkot, Bagalkot - 587101, Near Bank Of India",07947346237
Hotel Firdaus & Firdaus Mas..,"Hotel Firdaus, Mohammed Ali Road(Khadka Road), Athawade Bazar, Bhusawal - 425201, Near Lal Building",07947080607
Gobhaarati BEST Quality Mil..,"Pavani Plaza, Vidya Nagar Road, Vidya Nagar, Hyderabad - 500044, Near Pavani Plaza",08045790534
Sri Sai Spices,"House No 1-10-65/2, Near Little Flower School,Temple Alwal, Alwal, Hyderabad - 500010, Ram Nagar Colony, Opposite Shivalayam Temple",08045792658
Vanita Foods Pvt Ltd,"C 34, Mul Road, Chandrapur - 442401, Behind Adarsh Petrol Pump",07947338218
G S Foods,"AB Road, Dudhi, Mhow, Indore - 453441",+(91)-8519055011
M.R. PROTEINS,"TULSHI IND AREA 1 PLOT NO 71, B /H JAMVADI GIDC, Gondal, Rajkot - 360311, GUNDALA CKOKADI",+(91)-9712168155
Tandan Masale,"Pingalai Heights, Kathora Road,, Vmv Road, Amravati - 444604, Infront Of Rohini Park",07947444012
Chirag Provision Store,"Outside Bhamariya Nala  Mehsana, Near Malgodown, Malgodown, Mehsana - 384002, Mehsana",+(91)-9726277737
DailyCrate,"SATURNA, Near Darga, Saturna, Amravati - 444607, Near Delhi Public School",08045773171
Vns Amulya Traders,"2B, 13 Line Main Road, AT Agraharam, Guntur - 522004, Opp Vasu Digital Studios",07947395841
Rajasthani Gold Masale,"Plot No :- J126/A, RICO INDUSTRIAL AREA, Bhawanimandi, Jhalawar - 326502",07947057007
Lakshmi Narasimha Trading C..,"Shop No 240, Mahatmagandhi Wholesale Commercial Complex, Gollapudi, Vijayawada - 521225, Mahendra Nagar",+(91)-866-2418655
Saravana Stores,"Chikmagalur Bus Stand, Chikmagalur - 577101, OPP Panduranga Coffee Works",+(91)-9845865999
Vanashree Products,"No 18, 6th Cross,Parallel Road, Chamarajpet, Bangalore - 560018",08045798533
Indian Foods,"Shop No 2, Kankanady, Mangalore - 575002, Behind Kankanady Market",+(91)-824-4281301
R V Traders,"19 EBP Nagar, Veerappanchatram, Erode - 638004, PP Garden New Park",07947376248
Saravana Traders,"No 138, Sengunthapuram, Chithode, Erode - 638102, Near Old Police Station",07947376165
Sri Rajalakshmi Traders,"24 Kandhayan Thottam, Sullai Bus Stand, Veerappanchatram, Erode - 638004, Near Nandhinimonokar  Hospital",07947376206
Lakhpat Trading Corporation,"G -1st/15-16, Krishi Mandi, Mandore Road, Jodhpur - 342007",+(91)-9829080303
D M Spices,"Makad Wali Road, Ajmer Ho, Ajmer - 305001, Near Raj Potery",07947284531
Sreeja Dry Fruits & Spices,"RNG Apartment, Rashtrapati Road, Tanuku HO, Tanuku - 534211, Opposite Venkateshwara Swamy Temple",07947353220
Kakkuzhiyil Traders,"Ooty Road, Meppadi, Wayanad - 673577, Near Cardamom Processing Unit Thinapuram",07947202922
Healthy Products,"#MIG 14, Opp TNEB Power Plant, Hosur, Hosur - 635110, Near Sishya School, Thally Road,",07947443535
A-1 Aathi Traders,"79/70 Lalbagadur Street, Veerappanchatram, Erode - 638004",07947376071
Rca Masala Udyog,"Kamla Nehru Nagar, JODHPUR - 342008, Near Arora Sweets",07947063990
Popular Masala,"Plot No. 36, Shobhapur Road, Adhartal, Jabalpur - 482004, Industrial Area",+(91)-0761-4007481
Jose Traders,"Big Bazar, Kozhikode - 673001, Near Raiway Station",+(91)-495-2702199
Gs Traders,"GS TRADERS, Nethaji Road, Erode, Erode - 638107, ERODE MARKET",+(91)-0424-4031102
All Spices Markets,"Ginger Palace, Mattancherry, Ernakulam - 682002, Opposite Jeeva Matha Church",+(91)-9947063192
Poorna Exports,"No 12, Sampoornam Avenue, Vadapalani, Chennai - 600026, Near Ram Theatre Bus Stop",08045784073
Sujitha Enterprises,"Old No 4/203 New No 7/42a, Arogya Madha Street, Polichalur, Chennai - 600074, Opposite to Bus Terminus, Kalliamman Nagar",08045783782
Vashugolden Pvt. Ltd.,"Khicharon Ka Baas, Jaipur Road, Sikar HO, Sikar - 332001",+(91)-9887887697
Prince Foods,"13,Arul Jyothi Street,, Thendral Nagar,, Tiruchirappalli Airport, Trichy - 620007",07947465070
The Grains,"Shop Number A2/7, Noida Sector 110, Noida - 201304, Near Kanhan Bhog",07947234211
Balaji Trading Company,"Plot No. 85 Gyan Ram Gali No. 10 Deep Enclave Vikas Nagar Uttam Nagar, Uttam Nagar, Delhi - 110059",07947234835
Hari Sons INDIA Product,"B 38, Bharti Bhawan Road, Allahabad City, Allahabad - 211003, Loknath",07947278727
Guru Nanak Paneer Bhandar,"Building No4/9, Choti Sabji Mandi Janak Puri B1, Janakpuri, Delhi - 110058, Opposit Singh Sabha Gurudwara, Prem Nagar Tilak Nagar Metro Station Gate No 3",07947209953
Shan Minar,"A Block Gali No 23,H No 1385, Shree Ram Colony, Rajiv Nagar, Delhi - 110094, Near Jama  Masjid",+(91)-9910139540
Mangal Agencies,"New Line Ganga Shahar, Bikaner, Bikaner - 334001, Near Bafna School",07947285467
Kedara Masala,"Shop Number,2932,Kinari Bazar,, Chandni Chowk, Delhi - 110006, Near Kinari Bazar",07947162529
SMG PVT. LTD,"Near Sbi Bank Gokul 281303, Mathura - 281001",+(91)-7017023600
Mool Chand Gopal Krishna Gr..,"Kali Nadi Road, Lalkuan, Bulandshahr - 203001, Mandi Gurush Ganj",+(91)-9927242886
Anu Foods Appalam Manufactu..,"No 3298, Tnhb Colony West Anuppanady, Anuppanady, Madurai - 625009, Near BSNL Exchange",+(91)-9894457999
Indu Masale,"Building Name -  Mayfair   Shop No - 50 Opp  Khinwasara, Ulka Nagari, Ulkanagari, Aurangabad-Maharashtra - 431001, Khinwasara Woods",07947367028
R N Foods,"229/2A Ravisona Complex, Madhavnagar Road, Marketyard Sangli, Sangli - 416416, Behind Patilwada Hotel",+(91)-9130254361
A1 Rajesh Masale,"1318,  C Ward, Laxmipuri, Kolhapur - 416002, Near Sabji Mandai",+(91)-0231-2644725
Amrut Organic Products,"Bahane Plot , Sangli Nandre Road, Nandre, Nandre, Sangli - 416416, Behind Of Samrat Kadabakutti",+(91)-7038045895
Manglam Home Products,"Cotton Market Chowk, Dhamangaon Road, Yavatmal Ho, Yavatmal - 445001, Near Ganpati Mandir",+(91)-07232-243064
Agrivyapar,"Neemuch Road, Nai Abaadi, Mandsaur - 458001, Near Krashi Upaj Mandi",07947440865
Aarvi Exports,"54 and 55 Kanhaiya Nagar, Jodhpur Ho, Jodhpur - 342001, Near Sbi Bank Shikargarh",07947064416
Tirupati Spices,"Jaipur Golden, Gulab Badi, Rampura, Kota-Rajasthan - 324001, Behind Traffic Police Office Gulab Bari",+(91)-8619657030
Www.cooksvilla.com,"Plot No 150, 151, Mandore Rd, Maheshwari Colony, Mandore Road, Jodhpur - 342006, Near By Krishi Mandi",+(91)-7665576650
Balaaji Trading Coy And Btc..,"No 132/5, Block 8 BTC Mills, Sivathapuram, Salem - 636307, Near Kattur",+(91)-0427-2480938
Jiyanshi Rajasthani Foods,"Mata Ji Ka Mandir, Osian, Jodhpur - 342303",07947170973
Mithran Exports,"No 1 New, Pethanachiyamman 1 St Street, Villapuram, Madurai - 625012, Near By Koodakovil School",07947266604
Anu Foods Appalam Manufactu..,"No 3298, Tnhb Colony West Anuppanady, Anuppanady, Madurai - 625009, Near Palayampatti Nadar Higher Secondary School",+(91)-9894457999
Kohiinoor Mills,"Shahabaug, Puna Mahabaleshwar Road, Wai, Satara - 412803, Near Shahabaug",07947316798
Bharati Products,"414, Siddhanath Society, Shivaji Chowk, Bhiwandi, Bhiwandi - 421302, Near Sai Mandir",07947331991
Apana Masale,"A/p Kaledhon, Vita Mayani Road, Kaledhon Satara, Satara - 415312, Near Bank Of India",07947317286
Asuvara Masalewale,"Plot No M 28, Satara MIDC, Satara - 415004, Additional MIDC, Back Side Of Top Gear Company",07947316374
Shri Samarth Enterprises an..,"College Road, Gokul Colony, Rahuri, Ahmednagar - 413705, Near Bhagarathibai Vidyalay",+(91)-9096405808
Shraddha Masala,"Shop 2/A , Dwarka Bhai Niwas,, Dahanukar Wadi,Bunder Pakhadi, Kandivali West, Mumbai - 400067, Near Link Road",07947174690
Sadguru Masale And Dryfruit..,"Sry No -78 /3 , Plot No-19, Row House No-1, Vasantnagar, Khed, Khed Wadhe, Satara - 415003",07947317238
Ambica Enterprises,"Shop No. 7, Parag Plaza, Nagar Manmad Road, Savedi, Ahmednagar - 414003, Patrakr Chowk",+(91)-9819321232
Janta Supreme Punjabi Atta,"Sardar Nagar No 3,, Hemant Manjrekar Marg, Sion Koliwada, Mumbai - 400022, Samaj Mandir Hall",07947168409
A Amratlal & Co,"Building No 406, Ebrahim Rahemtulla Raod, Pydhonie, Mumbai - 400003, Oppo- Pydhoni Police Station",+(91)-022-23461548
Amrutlal Bhurabhai Co,"Ground Floor, Anand Bhuvan Building, 17 Babu Genu Road, Princess Street, Mumbai - 400002, Near Union Bank Of India & Behind Lohar Chawl, Dawa Bazaar",+(91)-022-22191111
Shree Ganesh Traders,"Shop Number 5 Sita Nagar, Dumping Road, Mulund West, Mumbai - 400080, Opposite BMC Godown",+(91)-8879112454
Amrut Industrial Products,"Chemical House, L B Shastri Marg, Gokul Nagar-Thane West, Thane - 400601, Next to Vardhaman Industrial Estate & Near Navneet Motors",+(91)-022-21722271
Naeem Masala,"Shop No 23 and 24, Mirza Ghalib Market, Matka Gali, Null Bazar, Mumbai - 400003, Near Gol Deval Temple",+(91)-9029377451
Shree Ram Trading Company,"Plot No 14, Market Yard, Pune Bangalore Highway, Umbraj, Karad - 415109",+(91)-2164-264612
Pravinam Traders,"Mansukh Building, Chitale Road, Dilli Gate, Ahmednagar - 414003, Near Dena Bank",+(91)-241-2551112
Swad Masale,"Main Road, Palus, Sangli - 416310, Near Sangram Bhavan",07947177044
G M Masale,"Hospital Road, Manerajuri, Sangli - 416408, Government Hospital",07947230575
Orggi Fresh,"C.S No.23/6/7,E, Kusum Heritage, Tarabai Park, Kolhapur - 416003, Opposite Pitali Ganpati Road",07947470662
Apana Masale,"A P Kaledhon, Vita Mayani Road, Omerga Osmanabad, Osmanabad - 413606, Near Bank Of India",07947321159
Apana Masale,"A P Kaledhon, Vita Mayani Road, Solapur City, Solapur - 413007, Near Bank Of India",07947364218
Pandya & Sons,"Vasant Market Yard, Shop No 311, 1st Lane, Sangli HO, Sangli - 416416, Market Yard",07947364638
Apana Masale,"AP Kaledhon, Vita Mayani Road, Bijapur Railway Station, Bijapur-Karnataka - 586104, Near Bank Of India",07947346129
Girnar Industries,"Sai Datta Complex, 100 Ft Road, Sangli - 416416, Near D Mart",07947271019
Nakshatra Gruha Udyog,"263 E Ward Chaitanya Appartment, Main Road, Tarabai Park, Kolhapur - 416003, Behind Waman Hari Pethe Jewellers",07947250682
Sajan Agencies,"Sajan Chambers, Anguri Bagh Road, Aurangabad HO, Aurangabad-Maharashtra - 431001, Behind Maratha High School",+(91)-9423955555
Belokar Spices,"Annapurna Gruh Udyog, Aarnav Heights, Flat No  05, Dhruva Nagar, Gangapur Road, Nashik - 422013, Near Motiwala Collage",+(91)-9096000221
Deep Traders,"Juna Mondha, Aurangabad Ho, Aurangabad-Maharashtra - 431001",07947366119
Prism Agencies,"Galaxy Park Apartment, Vapi Daman Road, Chala, Vapi - 396191, Near HDFC Bank, Opposite Parvarish Children Hospital",+(91)-7676768761
Shree Mahalaxmi Traders,"556/557 E Suresh Complex, Vyapari Peth, Shahupuri, Kolhapur - 416001, Near RBL Bank",+(91)-0231-2653376
Sartaj Trading Co. Kirana,"Near Police Chowki Chelipura, Chelipura, Aurangabad-Maharashtra - 431001, Opp Easy Dental",+(91)-9823093264
Bhakalo Fruits and Vegetabl..,"16 Sahyadri Shopping Centre, Solapur Ho, Solapur - 413001, Near Old Employment Chowk ,Beside Kamat Hotel",07947466684
Shivanjali Food Products,"Shivanjali Food Products, Haydrabad Road Ghungrala, Ghungarala, Nanded - 431709, Near Bus Stop Ghungrala",08045795682
Apana Masale,"Ap Kaledhon, Vita Mayani Road, Bagalkot, Bagalkot - 587101, Near Bank Of India",07947346237
Hotel Firdaus & Firdaus Mas..,"Hotel Firdaus, Mohammed Ali Road(Khadka Road), Athawade Bazar, Bhusawal - 425201, Near Lal Building",07947080607
Gobhaarati BEST Quality Mil..,"Pavani Plaza, Vidya Nagar Road, Vidya Nagar, Hyderabad - 500044, Near Pavani Plaza",08045790534
Sri Sai Spices,"House No 1-10-65/2, Near Little Flower School,Temple Alwal, Alwal, Hyderabad - 500010, Ram Nagar Colony, Opposite Shivalayam Temple",08045792658
Vanita Foods Pvt Ltd,"C 34, Mul Road, Chandrapur - 442401, Behind Adarsh Petrol Pump",07947338218
M.R. PROTEINS,"TULSHI IND AREA 1 PLOT NO 71, B /H JAMVADI GIDC, Gondal, Rajkot - 360311, GUNDALA CKOKADI",+(91)-9712168155
Tandan Masale,"Pingalai Heights, Kathora Road,, Vmv Road, Amravati - 444604, Infront Of Rohini Park",07947444012
DailyCrate,"SATURNA, Near Darga, Saturna, Amravati - 444607, Near Delhi Public School",08045773171
G S Foods,"AB Road, Dudhi, Mhow, Indore - 453441",+(91)-8519055011
Chirag Provision Store,"Outside Bhamariya Nala  Mehsana, Near Malgodown, Malgodown, Mehsana - 384002, Mehsana",+(91)-9726277737
Vns Amulya Traders,"2B, 13 Line Main Road, AT Agraharam, Guntur - 522004, Opp Vasu Digital Studios",07947395841
Rajasthani Gold Masale,"Plot No :- J126/A, RICO INDUSTRIAL AREA, Bhawanimandi, Jhalawar - 326502",07947057007
Lakshmi Narasimha Trading C..,"Shop No 240, Mahatmagandhi Wholesale Commercial Complex, Gollapudi, Vijayawada - 521225, Mahendra Nagar",+(91)-866-2418655
Saravana Stores,"Chikmagalur Bus Stand, Chikmagalur - 577101, OPP Panduranga Coffee Works",+(91)-9845865999
Indian Foods,"Shop No 2, Kankanady, Mangalore - 575002, Behind Kankanady Market",+(91)-824-4281301
Vanashree Products,"No 18, 6th Cross,Parallel Road, Chamarajpet, Bangalore - 560018",08045798533
A-1 Aathi Traders,"79/70 Lalbagadur Street, Veerappanchatram, Erode - 638004",07947376071
D M Spices,"Makad Wali Road, Ajmer Ho, Ajmer - 305001, Near Raj Potery",07947284531
Saravana Traders,"No 138, Sengunthapuram, Chithode, Erode - 638102, Near Old Police Station",07947376165
Sreeja Dry Fruits & Spices,"RNG Apartment, Rashtrapati Road, Tanuku HO, Tanuku - 534211, Opposite Venkateshwara Swamy Temple",07947353220
R V Traders,"19 EBP Nagar, Veerappanchatram, Erode - 638004, PP Garden New Park",07947376248
Lakhpat Trading Corporation,"G -1st/15-16, Krishi Mandi, Mandore Road, Jodhpur - 342007",+(91)-9829080303
Popular Masala,"Plot No. 36, Shobhapur Road, Adhartal, Jabalpur - 482004, Industrial Area",+(91)-0761-4007481
Healthy Products,"#MIG 14, Opp TNEB Power Plant, Hosur, Hosur - 635110, Near Sishya School, Thally Road,",07947443535
Rca Masala Udyog,"Kamla Nehru Nagar, JODHPUR - 342008, Near Arora Sweets",07947063990
Kakkuzhiyil Traders,"Ooty Road, Meppadi, Wayanad - 673577, Near Cardamom Processing Unit Thinapuram",07947202922
Jose Traders,"Big Bazar, Kozhikode - 673001, Near Raiway Station",+(91)-495-2702199
Sri Rajalakshmi Traders,"24 Kandhayan Thottam, Sullai Bus Stand, Veerappanchatram, Erode - 638004, Near Nandhinimonokar  Hospital",07947376206
Gs Traders,"GS TRADERS, Nethaji Road, Erode, Erode - 638107, ERODE MARKET",+(91)-0424-4031102
All Spices Markets,"Ginger Palace, Mattancherry, Ernakulam - 682002, Opposite Jeeva Matha Church",+(91)-9947063192
Sujitha Enterprises,"Old No 4/203 New No 7/42a, Arogya Madha Street, Polichalur, Chennai - 600074, Opposite to Bus Terminus, Kalliamman Nagar",08045783782
Vashugolden Pvt. Ltd.,"Khicharon Ka Baas, Jaipur Road, Sikar HO, Sikar - 332001",+(91)-9887887697
Poorna Exports,"No 12, Sampoornam Avenue, Vadapalani, Chennai - 600026, Near Ram Theatre Bus Stop",08045784073
Prince Foods,"13,Arul Jyothi Street,, Thendral Nagar,, Tiruchirappalli Airport, Trichy - 620007",07947465070
The Grains,"Shop Number A2/7, Noida Sector 110, Noida - 201304, Near Kanhan Bhog",07947234211
Shan Minar,"A Block Gali No 23,H No 1385, Shree Ram Colony, Rajiv Nagar, Delhi - 110094, Near Jama  Masjid",+(91)-9910139540
Balaji Trading Company,"Plot No. 85 Gyan Ram Gali No. 10 Deep Enclave Vikas Nagar Uttam Nagar, Uttam Nagar, Delhi - 110059",07947234835
Mangal Agencies,"New Line Ganga Shahar, Bikaner, Bikaner - 334001, Near Bafna School",07947285467
Hari Sons INDIA Product,"B 38, Bharti Bhawan Road, Allahabad City, Allahabad - 211003, Loknath",07947278727
Guru Nanak Paneer Bhandar,"Building No4/9, Choti Sabji Mandi Janak Puri B1, Janakpuri, Delhi - 110058, Opposit Singh Sabha Gurudwara, Prem Nagar Tilak Nagar Metro Station Gate No 3",07947209953
SMG PVT. LTD,"Near Sbi Bank Gokul 281303, Mathura - 281001",+(91)-7017023600
KBM Gai Chaap Masala,"B-19, Lawrence Road, Delhi - 110035, Industrial Area",07947227840
Omjee Gaichhap Masala,"C 23, Lawrence Road Industrial Area, Delhi - 110035, Near Keshav Puram Metro. Station",07947229032
Mool Chand Gopal Krishna Gr..,"Kali Nadi Road, Lalkuan, Bulandshahr - 203001, Mandi Gurush Ganj",+(91)-9927242886
Jiyanshi Rajasthani Foods,"Mata Ji Ka Mandir, Osian, Jodhpur - 342303",07947170973
Mithran Exports,"No 1 New, Pethanachiyamman 1 St Street, Villapuram, Madurai - 625012, Near By Koodakovil School",07947266604
Anu Foods Appalam Manufactu..,"No 3298, Tnhb Colony West Anuppanady, Anuppanady, Madurai - 625009, Near Palayampatti Nadar Higher Secondary School",+(91)-9894457999
Kohiinoor Mills,"Shahabaug, Puna Mahabaleshwar Road, Wai, Satara - 412803, Near Shahabaug",07947316798
Shri Samarth Enterprises an..,"College Road, Gokul Colony, Rahuri, Ahmednagar - 413705, Near Bhagarathibai Vidyalay",+(91)-9096405808
Sadguru Masale And Dryfruit..,"Sry No -78 /3 , Plot No-19, Row House No-1, Vasantnagar, Khed, Khed Wadhe, Satara - 415003",07947317238
Bharati Products,"414, Siddhanath Society, Shivaji Chowk, Bhiwandi, Bhiwandi - 421302, Near Sai Mandir",07947331991
Janta Supreme Punjabi Atta,"Sardar Nagar No 3,, Hemant Manjrekar Marg, Sion Koliwada, Mumbai - 400022, Samaj Mandir Hall",07947168409
Asuvara Masalewale,"Plot No M 28, Satara MIDC, Satara - 415004, Additional MIDC, Back Side Of Top Gear Company",07947316374
Apana Masale,"A/p Kaledhon, Vita Mayani Road, Kaledhon Satara, Satara - 415312, Near Bank Of India",07947317286
A Amratlal & Co,"Building No 406, Ebrahim Rahemtulla Raod, Pydhonie, Mumbai - 400003, Oppo- Pydhoni Police Station",+(91)-022-23461548
Shree Ganesh Traders,"Shop Number 5 Sita Nagar, Dumping Road, Mulund West, Mumbai - 400080, Opposite BMC Godown",+(91)-8879112454
Shraddha Masala,"Shop 2/A , Dwarka Bhai Niwas,, Dahanukar Wadi,Bunder Pakhadi, Kandivali West, Mumbai - 400067, Near Link Road",07947174690
Shree Ram Trading Company,"Plot No 14, Market Yard, Pune Bangalore Highway, Umbraj, Karad - 415109",+(91)-2164-264612
Ambica Enterprises,"Shop No. 7, Parag Plaza, Nagar Manmad Road, Savedi, Ahmednagar - 414003, Patrakr Chowk",+(91)-9819321232
Naeem Masala,"Shop No 23 and 24, Mirza Ghalib Market, Matka Gali, Null Bazar, Mumbai - 400003, Near Gol Deval Temple",+(91)-9029377451
Pravinam Traders,"Mansukh Building, Chitale Road, Dilli Gate, Ahmednagar - 414003, Near Dena Bank",+(91)-241-2551112
Amrut Industrial Products,"Chemical House, L B Shastri Marg, Gokul Nagar-Thane West, Thane - 400601, Next to Vardhaman Industrial Estate & Near Navneet Motors",+(91)-022-21722271
Amrutlal Bhurabhai Co,"Ground Floor, Anand Bhuvan Building, 17 Babu Genu Road, Princess Street, Mumbai - 400002, Near Union Bank Of India & Behind Lohar Chawl, Dawa Bazaar",+(91)-022-22191111
Pandya & Sons,"Vasant Market Yard, Shop No 311, 1st Lane, Sangli HO, Sangli - 416416, Market Yard",07947364638
G M Masale,"Hospital Road, Manerajuri, Sangli - 416408, Government Hospital",07947230575
