Kalantri Grinding Mill,"R.No.600, Gadgil Gali, Raviwar Peth, Nashik - 422002, Near Hemlata Cinema",+(91)-253-2570848
Ravi Masale,"618 Market Yard,Gate No.5,Gultekdi,Pune-37, Pune, Aurangabad-Maharashtra - 431003",+(91)-9823499997
R A Masale Pvt Ltd,"802/13 Building, Tasgaon Sangli Road, Tasgaon Sangli, Sangli - 416312, Near R A Masale",+(91)-02346-264754
Sainath Trading Company,"39-B Jodbhavi Peth, Mangalvar Peth Sholapur, Solapur - 413002, Near Kumbhar Ves Jain Mandir",+(91)-217-2327682
Relish Mahalaxmi Suresh Mas..,"1358, Padmavati Heights, 1b,, Dhanya Line, Laxmipuri, Kolhapur - 416002, Near Reliance Mall",+(91)-231-2642018
Ms Janta Seva Mirchi Masala..,"G. No 17, Industrial Area, Sindkhed Raja Road, Deulgaon Raja, Buldhana - 443204, Pimpalner",+(91)-7620809060
Vichare Brothers Masalawala,"374, 1st Floor Vichare Building, Gendi Gate Road, Vadodara - 390017, Near Darwaja",+(91)-0265-2432649
Shree Mateshwari Oil And Su..,"B 34 To 36 Jalaram Nagar Gujrat Housing Board, Pandesara, Surat - 394221, Near Piyush Point Char Rasta",+(91)-9978803754
S K Masala,"Shop No 10/10, Chauta Bazaar, Surat - 395003, Near Chauta Pul",+(91)-0261-2591475
Padmavati Foods,"A/4 Bharat Patel Estate, Dashrath, Dashrath, Vadodara - 391740, ICD Warehouse Road",+(91)-9691392862
Five Star Dehydration PVT. ..,"Rampara Road, Talaja, Rampara Road, Talaja - 364140",+(91)-02842-240267
Umiya Enterprises,"519, Lalita Towers, Dinesh Mill Road, Race Course Road, Vadodara - 390007, Near Railway Station",07947256057
Mudgal Dryfruits,"Bangi Kunta, Patel Road, Raichur HO, Raichur - 584101",+(91)-9880792082
Nandigram Agro,"Gharkul Nivas, Phule Nagar, Shivaji Nagar Nanded, Nanded - 431602, Opp Temple",07947320772
Maharaja Dehydration Pvt Lt..,"Survey No 56/P, National Highway No 8 E, Mahuva, Bhavnagar - 364290, Umaniyavadar",+(91)-2844-246277
Gopal Snacks Pvt Ltd,"Plot No, 2322,2323,2324, Unit 1, F Road, Lodhika, Rajkot - 360035, Gate No 2, Metoda GIDC",+(91)-02827-287370
Shree Ramkrushna Anaj Bhand..,"Bardan Wala Road, Grain Market, Jamnagar - 361001, Dana Peth",+(91)-288-2555658
Bombay Stores,"Door No 3-6-690/3 & 4, D V Arcade, Main Road, Himayat Nagar, Hyderabad - 500029, Opposite Agrawala Sweets",+(91)-040-27631040
Vasant Masala Pvt Ltd,"429, 4th Floor, Sarkhej Gandhinagar Highway, Ahmedabad - 380055, Near Gurudwara & Opposite Vishal Mega Mart",+(91)-079-26850140
Shree Bhagwati Flour & Food..,"Survey No 430, Changodar, Sanand - 382213, Sarkhej Bavla Highway, Village Moraiya",+(91)-2717-251871
Gangwal (Corporate Office),"No 125, Indore, Indore - 452003, Near Sai Baba Mandir, Tilakpath",+(91)-0731-4226730
A & S Dry Fruits,"Shop No 29,Ground Floor,   Advait Complex, Bodakdev, Ahmedabad - 380054, Opposide Soham Tower, Behind Sandesh Press",+(91)-79-26765653
Shweta Trademart Pvt Ltd,"327/38, Mangal Udyog Nagar, Nemawar Road, Palda, Indore - 452020, Behind Reliance Petrol Pump",+(91)-9981547747
Amravati Naturals,"Handa Complex, Ashiyad Chouk Shegaon Rahatgaon Road Amravati, Vmv Road, Amravati - 444604, Ashiyad Chouk Handa Complex",07947173044
Amrutlal & Sons,"Survey No 37, Plot No 44/45, Gondal Road, Gondal Road, Rajkot - 360004",+(91)-281-2386089
Kitchen Xpress Overseas Ltd,"Plot No 29-P, Santej Vadsar Road, Santej, Kalol-Gandhinagar-Gujarat - 382721, Tal-Kalol",+(91)-02764-268371
Pushp Brand Masale,"76, Pandhrinath Chowk, Gautampura, Indore - 453220",+(91)-9977841313
Gokul Refoils & Solvent LTD,"Gokul House 43, Shrimali Society, Navrangpura, Ahmedabad - 380009, Opp Shikhar Complex, Opp Vadilal House",+(91)-79-66615253
Gajanand Foods Pvt Ltd,"Gajanand House, Plot No 814, Kothari Cross Road, Santej, Gandhinagar-Gujarat - 382721, Near Pima 2, Taluka Kalol",+(91)-79-286021
Vasant Masala Pvt Ltd,"A/118, 1st Floor, Lilamani Trade Centre, Dudheshwar Road, Delhi Darwaja, Ahmedabad - 380004, Near Brts Circle, Outside Delhi Darwaza",+(91)-079-25621443
Vitagreen Products Pvt Ltd,"Plot Number G 557, 3rd Gate, Kalavad Road, Metoda Gidc, Rajkot - 360003, Gidc Lodhika",+(91)-9574009077
Gharrkul Industries Pvt. Lt..,"C-43/1, Amravati Midc, Amravati - 444607, Near Midc Area",+(91)-0721-2590246
Chopda Foods & Spices,"211, Ring Road, Indore - 452010, Gram Palda, Samta Nagar",+(91)-9691082804
Pavan Traders,"Hulugodu Honnavalli Post, Sringeri, Chikmagalur - 577139",+(91)-08265-250850
Shree Umiya Gruh Udhyog,"Mahudi Road, Pethapur Cross Road, Pethapur, Gandhinagar-Gujarat - 382610",+(91)-9824515330
Giri Trading Agency Pvt Ltd,"No. 24/4, Ground Floor, 5th Cross, Sampige Road, Malleswaram, Bangalore - 560003, Near KSIC Mysore Silk",+(91)-080-23563001
MTR Foods Pvt Ltd (Corporat..,"No. 1, 1st & 2nd Floor, 100 Feet Inner Ring Road, Ejipura, Bangalore - 560047, Opposite Oss Mall",+(91)-080-40812100
Khan Masala,"68, Near Tarjume Wali Masjid, Bhopal - 462001, Near Motia Park",07947296594
J S Masala Company,"No.61/7, Magadi Main Road, Pete Channappa Industrial Estate, Kamakshipalya, Bangalore - 560079",+(91)-80-23102818
H M Sports,"Shop No 1, Parmanand Apartment, Jaripatka, Nagpur - 440014, Opposite Indora Police Chowky",+(91)-712-2655888
Vishnu Masala Food Products..,"No.446, 18th Main, Jayanagar 4th T Block, Bangalore - 560041",+(91)-80-22455001
Gauri Shankar Traders,"Bajariya Chowk, Mahesh Palace, Santra Market Road, Santra Market Roaddaulat Patel Marg, Bajeria, Nagpur - 440018",+(91)-712-2721970
GRB Dairy Foods Pvt Ltd,"Old No. 484, New No. 57, 2nd Floor, 33rd Cross, 9th Main Road, Jayanagar 4th Block, Bangalore - 560011, Near Cafe Coffee Day",+(91)-80-26655651
Suruchi Spices Pvt Ltd,"55/1, Bhandara Road, Kapsi, Nagpur - 440035, Near Umiya Industrial Estate, Near Pardi Octrai Naka",+(91)-0712-2278378
Konkan Traders,"No.7, New Milagres Mansion, Falnir Road, Mangalore - 575002, Opposite to Milagres Church",+(91)-824-2427517
Bon Masala & Food Products,"No 5-32/4 Yeyyadi Industrial Estate, Yeyyadi Industrial Estate, Yeyyadi, Mangalore - 575008, Opposite Narans Factory",+(91)-824-2248301
Sree Annapoorna Foods,"No 643/3-B, Edayarpalayam Road, Vadavalli, Coimbatore - 641041",+(91)-0422-2403881
Nutsbay,"No 557 - 558, Raja Street, Town Hall, Coimbatore - 641001, Near Thermutti",+(91)-422-2552040
Keerti Spices,"6-7 Narayan Colony, Nayapura, Mandore Road, Jodhpur - 342006",+(91)-9928977009
Arihant Masala Udhyog,"Out Side Siwanchi Gate, Nr Bhika Piou, Pratap Nagar, Jodhpur - 342003, Near Pratap Nagar",+(91)-9950980952
Arihant Masala Udhyog,"Out Side Siwanchi Gate, Pratap Nagar, Jodhpur - 342003, Near Bikha Piou",+(91)-9950980952
Thirumurugan Stores & Velmu..,"No 357/358, Rangai Gounder Street, Town Hall, Coimbatore - 641001, Near Velmurugan Stores",+(91)-422-2396168
Geet Masale (Unit Of Laught..,"Natraj Colony, Foysagar Road, Ram Nagar, Ajmer - 305004, Near Honey Garden",07947060409
GCT Natures Products,"No.67, V.K.Road, Saravanampatti, Coimbatore - 641035, Near By Prozone Mall",+(91)-422-4212987
Adeshwar Spices,"H-1-87, Agro Food Park, Boranada, Jodhpur - 342012",+(91)-02931-219749
Eastern Condiments Pvt Ltd ..,"No 34/137 A, NH  Bypass Road, Edapally, Ernakulam - 682024, Near Dhe Puttu",
Swastik,"A -7,, Gandhi Path, Vaishali Nagar, Jaipur - 302021, Opposite Bharat Apartment",07947065553
Shri Govind Foods Udyog,"44 Prem Nagar-B, Prem Nagar, Agra Road, Jaipur - 302004, Near Icfai University",07947063496
Manjilas food tech pvt ltd,"Tc 16-1382, Sasthri Road, Nellikkunnu, Thrissur East, Thrissur - 680005",+(91)-487-2420895
Ciba Masala Udyog Pvt Ltd,"Ciba Spices, Itarana Road, Alwar HO, Alwar - 301001, Old Industrial Area",+(91)-144-2332751
Aachi Masala Foods Pvt Ltd ..,"No 1926, 34th Street, Anna Nagar, Chennai - 600040, Opposite West Bus Dippo, Thangam Colony",+(91)-7502929289
Girijan Cooperative Corpora..,"East Point Colony, Visakhapatnam - 530017, Opposite New Vuda Park,",+(91)-891-2796164
B&b Organics - Online Organ..,"No B3 Praveen Solai Apartment, Ground Floor,Lalgudi Main Road, Pichandarkovil, Trichy - 621216, No 1 Toll Gate",+(91)-9787738132
MTR Foods Pvt Ltd,"No 67, Kunrathur Main Road, Porur, Chennai - 600116, Near Electrical Substation & TMB Bank",+(91)-44-24825788
Agra Aloo Supplier,"Nehru Enclave, Fatehabad Road, Agra - 282001, Near  Mandi Samiti, Nagla Mahadev, Bamrauli, Katara",+(91)-9359616558
K S P Organic Oil,"Old No 33A/16A New No 23, Indira Nagar Mohanur Road, Namakkal Fort, Namakkal - 637001",07947326869
Chiraagi By The Chase,"Plot No. 96,Riddhi Siddhi Nagar  Ext., Kalwar Road-Jhotwara, Jhotwara, Jaipur - 302012, Near Kardhani",07947062646
Sri Vidya Upasaka Nilayam,"No 43, South Mada Street, Mylapore, Chennai - 600004, Near Vasantha Bhavan Hotel",+(91)-044-24958310
Jayanth Organic Agro Farms ..,"42, Kamarajar Bazaar, Bodinayakanur, Theni - 625513, Near to Anna Malai Finance",+(91)-4546-281110
The Pollachi Masala,"No.53/83 R P Colony, Anamalai Road, Pollachi - 642001, Zamin Uthukuli",+(91)-9698217954
Premier Lakshmi Agro Foods ..,"Door No 477, Palakkad Main Road, Kunniyamuthur, Coimbatore - 641008, Near to Mosque",+(91)-422-2251231
Dharampal Satyapal Ltd (Hea..,"C-6-10, DS Road, Noida Sector 67, Noida - 201301, Near Haldirams Factory",+(91)-0120-4032200
Roopak Stores Pvt Ltd,"6/9, Ajmal Khan Road, Karol Bagh, Delhi - 110005, Opposite Punjab Sweets Corner",+(91)-9811173222
Nonand Rai Bhola Nath,"Shop No. 6691, Khari Baoli, Delhi - 110006, Near Sbi Bank",07947210196
Shubham Goldiee Masale Pvt ..,"House Number 51/40, Biharana Road, Nayaganj, Kanpur - 208001, Ghanta Ghar",+(91)-0512-2302737
Munshi Panna Masala Udyog P..,"Plot No-51,Rj Estate Peera Khar, Shahdra, Nunhai, Agra - 282006, Behind Gaurav Vatika",+(91)-562-2970148
Thillais Masala,"No -1B, Patel Road, First Street,Ngr Nagar,Pandian Nagar, Virudhunagar - 626001",07947057567
Tiger Longi Industries,"G1-83 Karni Industrial Area, Pugal Road, Bikaner HO, Bikaner - 334001",+(91)-151-2253753
Madurai Meenakshi Appalam M..,"No:4/22, Chinthamani Annupanadi Line Road, Chinthamani, Chintamani, Madurai - 625009, Madurai Meenakshi Appalam",07947265571
Sujep Wachstum Agro Tech,"No:22,, Indra Nagar, 4th Street, K.V.Salai, Thathaneri, Madurai - 625018, Near Pillayar Kovil",+(91)-0452-2669421
Trishul Tea & Spices,"Trishul House, Main Market, Chirawa, Jhunjhunu - 333026, Near Kalyan Ji Mandir",+(91)-1596-220344
Patanjali (Head Office),"Bahadrabad, Haridwar - 249402, Near Rodi Belwala",+(91)-8084993236
Sri Ganesh Traders,"K-64/55 Goladinanath, Gola Dinanath Road, Varanasi H O, Varanasi - 221001, Near Hanuman Mandir",+(91)-542-2403087
Jay Bharat Spices Pvt Ltd,"Jagatpur Cuttack, Cuttack - 754021, Near Imam Nagar, New Industrial Estate",+(91)-671-2490255
Ghar Sansar Super Store,"Hospital Road, Tajpur, Samastipur - 848130",07947335754
Mana MAA Super Store,"697, Lake Town, Block A, Lake Town, Laketown, Kolkata - 700089, Near Punjab National Bank",+(91)-33-40015671
Kalyani Life Institute,"B-04/382, Kalyani, Kalyani Ho, Kalyani - 741235, Buddhapark Fire Brigade",07947400076
Apana Masale,"A/P Kaledhon, Vita Mayani Road, Pune City, Pune - 411002, Near Bank Of India",07947208543
New Sakhi Enterprises,"Survey No. 22/5/1,, Tuljai Colony No. 2, Thergaon, Pune - 411033, Near Sancheti School",+(91)-9922379795
Swanand Shatau,"Pune Nashik Highway, Narayangaon Ho, Narayangaon - 410504, Oppsite Mauli Misal House",07947315510
SRI BANNARI FOODS,"50, Shivaji Nagar CHS, Opp Swastik Chambur, Chembur East, Navi Mumbai - 400071, Dana Market APMC",07947219643
Ashwini Enterprises,"Maa Durga Seva Society, Wadi Lal Gosalia Road, Kandivali West, Mumbai - 400067, Sanjay Nagar, Near Ekta Nagar",07947182461
Jijai Masale,"Goleshwar Road, Karad, Karad - 415110, Backside Siddharth Magal Karyalay",+(91)-9767116406
A P Patil Trading Company,"Plot No 255, Lane No 3, Marketyard Sangli, Sangli - 416416, APMC",+(91)-9209197711
Shivam Traders,"Plot No 40, 1st Lane, Marketyard Sangli, Sangli - 416416, Vasant Market Yard",+(91)-0233-2670319
Aishwarya Kolhapuri Masale,"Vivekanand College Road, Nagala Park, Kolhapur - 416003, Near Vivekanand College",07947078340
Appa Organic Edible Oil,"Pune Banglore Highway, Kalamwadi, Sangli - 415406, Near Devraj Hotel",07947365201
Indu Masale,"Building Name -  Mayfair   Shop No - 50 Opp  Khinwasara, Ulka Nagari, Ulkanagari, Aurangabad-Maharashtra - 431001, Khinwasara Woods",07947367028
R N Foods,"229/2A Ravisona Complex, Madhavnagar Road, Marketyard Sangli, Sangli - 416416, Behind Patilwada Hotel",+(91)-9130254361
A1 Rajesh Masale,"1318,  C Ward, Laxmipuri, Kolhapur - 416002, Near Sabji Mandai",+(91)-0231-2644725
Amrut Organic Products,"Bahane Plot , Sangli Nandre Road, Nandre, Nandre, Sangli - 416416, Behind Of Samrat Kadabakutti",+(91)-7038045895
Manglam Home Products,"Cotton Market Chowk, Dhamangaon Road, Yavatmal Ho, Yavatmal - 445001, Near Ganpati Mandir",+(91)-07232-243064
Agrivyapar,"Neemuch Road, Nai Abaadi, Mandsaur - 458001, Near Krashi Upaj Mandi",07947440865
Aarvi Exports,"54 and 55 Kanhaiya Nagar, Jodhpur Ho, Jodhpur - 342001, Near Sbi Bank Shikargarh",07947064416
Tirupati Spices,"Jaipur Golden, Gulab Badi, Rampura, Kota-Rajasthan - 324001, Behind Traffic Police Office Gulab Bari",+(91)-8619657030
Www.cooksvilla.com,"Plot No 150, 151, Mandore Rd, Maheshwari Colony, Mandore Road, Jodhpur - 342006, Near By Krishi Mandi",+(91)-7665576650
Balaaji Trading Coy And Btc..,"No 132/5, Block 8 BTC Mills, Sivathapuram, Salem - 636307, Near Kattur",+(91)-0427-2480938
Jiyanshi Rajasthani Foods,"Mata Ji Ka Mandir, Osian, Jodhpur - 342303",07947170973
Mithran Exports,"No 1 New, Pethanachiyamman 1 St Street, Villapuram, Madurai - 625012, Near By Koodakovil School",07947266604
Anu Foods Appalam Manufactu..,"No 3298, Tnhb Colony West Anuppanady, Anuppanady, Madurai - 625009, Near Palayampatti Nadar Higher Secondary School",+(91)-9894457999
Sadguru Masale And Dryfruit..,"Sry No -78 /3 , Plot No-19, Row House No-1, Vasantnagar, Khed, Khed Wadhe, Satara - 415003",07947317238
Shri Samarth Enterprises an..,"College Road, Gokul Colony, Rahuri, Ahmednagar - 413705, Near Bhagarathibai Vidyalay",+(91)-9096405808
Kohiinoor Mills,"Shahabaug, Puna Mahabaleshwar Road, Wai, Satara - 412803, Near Shahabaug",07947316798
Apana Masale,"A/p Kaledhon, Vita Mayani Road, Kaledhon Satara, Satara - 415312, Near Bank Of India",07947317286
Asuvara Masalewale,"Plot No M 28, Satara MIDC, Satara - 415004, Additional MIDC, Back Side Of Top Gear Company",07947316374
Janta Supreme Punjabi Atta,"Sardar Nagar No 3,, Hemant Manjrekar Marg, Sion Koliwada, Mumbai - 400022, Samaj Mandir Hall",07947168409
Shraddha Masala,"Shop 2/A , Dwarka Bhai Niwas,, Dahanukar Wadi,Bunder Pakhadi, Kandivali West, Mumbai - 400067, Near Link Road",07947174690
A Amratlal & Co,"Building No 406, Ebrahim Rahemtulla Raod, Pydhonie, Mumbai - 400003, Oppo- Pydhoni Police Station",+(91)-022-23461548
Bharati Products,"414, Siddhanath Society, Shivaji Chowk, Bhiwandi, Bhiwandi - 421302, Near Sai Mandir",07947331991
Shree Ganesh Traders,"Shop Number 5 Sita Nagar, Dumping Road, Mulund West, Mumbai - 400080, Opposite BMC Godown",+(91)-8879112454
Shree Ram Trading Company,"Plot No 14, Market Yard, Pune Bangalore Highway, Umbraj, Karad - 415109",+(91)-2164-264612
Ambica Enterprises,"Shop No. 7, Parag Plaza, Nagar Manmad Road, Savedi, Ahmednagar - 414003, Patrakr Chowk",+(91)-9819321232
Naeem Masala,"Shop No 23 and 24, Mirza Ghalib Market, Matka Gali, Null Bazar, Mumbai - 400003, Near Gol Deval Temple",+(91)-9029377451
Pravinam Traders,"Mansukh Building, Chitale Road, Dilli Gate, Ahmednagar - 414003, Near Dena Bank",+(91)-241-2551112
Amrut Industrial Products,"Chemical House, L B Shastri Marg, Gokul Nagar-Thane West, Thane - 400601, Next to Vardhaman Industrial Estate & Near Navneet Motors",+(91)-022-21722271
Amrutlal Bhurabhai Co,"Ground Floor, Anand Bhuvan Building, 17 Babu Genu Road, Princess Street, Mumbai - 400002, Near Union Bank Of India & Behind Lohar Chawl, Dawa Bazaar",+(91)-022-22191111
Swad Masale,"Main Road, Palus, Sangli - 416310, Near Sangram Bhavan",07947177044
Pandya & Sons,"Vasant Market Yard, Shop No 311, 1st Lane, Sangli HO, Sangli - 416416, Market Yard",07947364638
G M Masale,"Hospital Road, Manerajuri, Sangli - 416408, Government Hospital",07947230575
Deep Traders,"Juna Mondha, Aurangabad Ho, Aurangabad-Maharashtra - 431001",07947366119
Girnar Industries,"Sai Datta Complex, 100 Ft Road, Sangli - 416416, Near D Mart",07947271019
Nakshatra Gruha Udyog,"263 E Ward Chaitanya Appartment, Main Road, Tarabai Park, Kolhapur - 416003, Behind Waman Hari Pethe Jewellers",07947250682
Sajan Agencies,"Sajan Chambers, Anguri Bagh Road, Aurangabad HO, Aurangabad-Maharashtra - 431001, Behind Maratha High School",+(91)-9423955555
Apana Masale,"A P Kaledhon, Vita Mayani Road, Solapur City, Solapur - 413007, Near Bank Of India",07947364218
Apana Masale,"AP Kaledhon, Vita Mayani Road, Bijapur Railway Station, Bijapur-Karnataka - 586104, Near Bank Of India",07947346129
Belokar Spices,"Annapurna Gruh Udyog, Aarnav Heights, Flat No  05, Dhruva Nagar, Gangapur Road, Nashik - 422013, Near Motiwala Collage",+(91)-9096000221
Apana Masale,"A P Kaledhon, Vita Mayani Road, Omerga Osmanabad, Osmanabad - 413606, Near Bank Of India",07947321159
Shree Mahalaxmi Traders,"556/557 E Suresh Complex, Vyapari Peth, Shahupuri, Kolhapur - 416001, Near RBL Bank",+(91)-0231-2653376
Prism Agencies,"Galaxy Park Apartment, Vapi Daman Road, Chala, Vapi - 396191, Near HDFC Bank, Opposite Parvarish Children Hospital",+(91)-7676768761
Bhakalo Fruits and Vegetabl..,"16 Sahyadri Shopping Centre, Solapur Ho, Solapur - 413001, Near Old Employment Chowk ,Beside Kamat Hotel",07947466684
Orggi Fresh,"C.S No.23/6/7,E, Kusum Heritage, Tarabai Park, Kolhapur - 416003, Opposite Pitali Ganpati Road",07947470662
Sartaj Trading Co. Kirana,"Near Police Chowki Chelipura, Chelipura, Aurangabad-Maharashtra - 431001, Opp Easy Dental",+(91)-9823093264
Apana Masale,"Ap Kaledhon, Vita Mayani Road, Bagalkot, Bagalkot - 587101, Near Bank Of India",07947346237
Shivanjali Food Products,"Shivanjali Food Products, Haydrabad Road Ghungrala, Ghungarala, Nanded - 431709, Near Bus Stop Ghungrala",08045795682
Hotel Firdaus & Firdaus Mas..,"Hotel Firdaus, Mohammed Ali Road(Khadka Road), Athawade Bazar, Bhusawal - 425201, Near Lal Building",07947080607
Gobhaarati BEST Quality Mil..,"Pavani Plaza, Vidya Nagar Road, Vidya Nagar, Hyderabad - 500044, Near Pavani Plaza",08045790534
Sri Sai Spices,"House No 1-10-65/2, Near Little Flower School,Temple Alwal, Alwal, Hyderabad - 500010, Ram Nagar Colony, Opposite Shivalayam Temple",08045792658
Vanita Foods Pvt Ltd,"C 34, Mul Road, Chandrapur - 442401, Behind Adarsh Petrol Pump",07947338218
Tandan Masale,"Pingalai Heights, Kathora Road,, Vmv Road, Amravati - 444604, Infront Of Rohini Park",07947444012
G S Foods,"AB Road, Dudhi, Mhow, Indore - 453441",+(91)-8519055011
Chirag Provision Store,"Outside Bhamariya Nala  Mehsana, Near Malgodown, Malgodown, Mehsana - 384002, Mehsana",+(91)-9726277737
DailyCrate,"SATURNA, Near Darga, Saturna, Amravati - 444607, Near Delhi Public School",08045773171
M.R. PROTEINS,"TULSHI IND AREA 1 PLOT NO 71, B /H JAMVADI GIDC, Gondal, Rajkot - 360311, GUNDALA CKOKADI",+(91)-9712168155
Vns Amulya Traders,"2B, 13 Line Main Road, AT Agraharam, Guntur - 522004, Opp Vasu Digital Studios",07947395841
Rajasthani Gold Masale,"Plot No :- J126/A, RICO INDUSTRIAL AREA, Bhawanimandi, Jhalawar - 326502",07947057007
Lakshmi Narasimha Trading C..,"Shop No 240, Mahatmagandhi Wholesale Commercial Complex, Gollapudi, Vijayawada - 521225, Mahendra Nagar",+(91)-866-2418655
Saravana Stores,"Chikmagalur Bus Stand, Chikmagalur - 577101, OPP Panduranga Coffee Works",+(91)-9845865999
Vanashree Products,"No 18, 6th Cross,Parallel Road, Chamarajpet, Bangalore - 560018",08045798533
Indian Foods,"Shop No 2, Kankanady, Mangalore - 575002, Behind Kankanady Market",+(91)-824-4281301
A-1 Aathi Traders,"79/70 Lalbagadur Street, Veerappanchatram, Erode - 638004",07947376071
R V Traders,"19 EBP Nagar, Veerappanchatram, Erode - 638004, PP Garden New Park",07947376248
Saravana Traders,"No 138, Sengunthapuram, Chithode, Erode - 638102, Near Old Police Station",07947376165
D M Spices,"Makad Wali Road, Ajmer Ho, Ajmer - 305001, Near Raj Potery",07947284531
Sri Rajalakshmi Traders,"24 Kandhayan Thottam, Sullai Bus Stand, Veerappanchatram, Erode - 638004, Near Nandhinimonokar  Hospital",07947376206
Lakhpat Trading Corporation,"G -1st/15-16, Krishi Mandi, Mandore Road, Jodhpur - 342007",+(91)-9829080303
Kakkuzhiyil Traders,"Ooty Road, Meppadi, Wayanad - 673577, Near Cardamom Processing Unit Thinapuram",07947202922
Healthy Products,"#MIG 14, Opp TNEB Power Plant, Hosur, Hosur - 635110, Near Sishya School, Thally Road,",07947443535
Rca Masala Udyog,"Kamla Nehru Nagar, JODHPUR - 342008, Near Arora Sweets",07947063990
Popular Masala,"Plot No. 36, Shobhapur Road, Adhartal, Jabalpur - 482004, Industrial Area",+(91)-0761-4007481
Jose Traders,"Big Bazar, Kozhikode - 673001, Near Raiway Station",+(91)-495-2702199
Sreeja Dry Fruits & Spices,"RNG Apartment, Rashtrapati Road, Tanuku HO, Tanuku - 534211, Opposite Venkateshwara Swamy Temple",07947353220
Gs Traders,"GS TRADERS, Nethaji Road, Erode, Erode - 638107, ERODE MARKET",+(91)-0424-4031102
Poorna Exports,"No 12, Sampoornam Avenue, Vadapalani, Chennai - 600026, Near Ram Theatre Bus Stop",08045784073
Vashugolden Pvt. Ltd.,"Khicharon Ka Baas, Jaipur Road, Sikar HO, Sikar - 332001",+(91)-9887887697
Prince Foods,"13,Arul Jyothi Street,, Thendral Nagar,, Tiruchirappalli Airport, Trichy - 620007",07947465070
All Spices Markets,"Ginger Palace, Mattancherry, Ernakulam - 682002, Opposite Jeeva Matha Church",+(91)-9947063192
Sujitha Enterprises,"Old No 4/203 New No 7/42a, Arogya Madha Street, Polichalur, Chennai - 600074, Opposite to Bus Terminus, Kalliamman Nagar",08045783782
Balaji Trading Company,"Plot No. 85 Gyan Ram Gali No. 10 Deep Enclave Vikas Nagar Uttam Nagar, Uttam Nagar, Delhi - 110059",07947234835
The Grains,"Shop Number A2/7, Noida Sector 110, Noida - 201304, Near Kanhan Bhog",07947234211
Hari Sons INDIA Product,"B 38, Bharti Bhawan Road, Allahabad City, Allahabad - 211003, Loknath",07947278727
Guru Nanak Paneer Bhandar,"Building No4/9, Choti Sabji Mandi Janak Puri B1, Janakpuri, Delhi - 110058, Opposit Singh Sabha Gurudwara, Prem Nagar Tilak Nagar Metro Station Gate No 3",07947209953
SMG PVT. LTD,"Near Sbi Bank Gokul 281303, Mathura - 281001",+(91)-7017023600
Kedara Masala,"Shop Number,2932,Kinari Bazar,, Chandni Chowk, Delhi - 110006, Near Kinari Bazar",07947162529
Mool Chand Gopal Krishna Gr..,"Kali Nadi Road, Lalkuan, Bulandshahr - 203001, Mandi Gurush Ganj",+(91)-9927242886
Omjee Gaichhap Masala,"C 23, Lawrence Road Industrial Area, Delhi - 110035, Near Keshav Puram Metro. Station",07947229032
KBM Gai Chaap Masala,"B-19, Lawrence Road, Delhi - 110035, Industrial Area",07947227840
Anu Foods Appalam Manufactu..,"No 3298, Tnhb Colony West Anuppanady, Anuppanady, Madurai - 625009, Near BSNL Exchange",+(91)-9894457999
Indu Masale,"Building Name -  Mayfair   Shop No - 50 Opp  Khinwasara, Ulka Nagari, Ulkanagari, Aurangabad-Maharashtra - 431001, Khinwasara Woods",07947367028
R N Foods,"229/2A Ravisona Complex, Madhavnagar Road, Marketyard Sangli, Sangli - 416416, Behind Patilwada Hotel",+(91)-9130254361
A1 Rajesh Masale,"1318,  C Ward, Laxmipuri, Kolhapur - 416002, Near Sabji Mandai",+(91)-0231-2644725
Amrut Organic Products,"Bahane Plot , Sangli Nandre Road, Nandre, Nandre, Sangli - 416416, Behind Of Samrat Kadabakutti",+(91)-7038045895
Manglam Home Products,"Cotton Market Chowk, Dhamangaon Road, Yavatmal Ho, Yavatmal - 445001, Near Ganpati Mandir",+(91)-07232-243064
Agrivyapar,"Neemuch Road, Nai Abaadi, Mandsaur - 458001, Near Krashi Upaj Mandi",07947440865
Aarvi Exports,"54 and 55 Kanhaiya Nagar, Jodhpur Ho, Jodhpur - 342001, Near Sbi Bank Shikargarh",07947064416
Tirupati Spices,"Jaipur Golden, Gulab Badi, Rampura, Kota-Rajasthan - 324001, Behind Traffic Police Office Gulab Bari",+(91)-8619657030
Www.cooksvilla.com,"Plot No 150, 151, Mandore Rd, Maheshwari Colony, Mandore Road, Jodhpur - 342006, Near By Krishi Mandi",+(91)-7665576650
Balaaji Trading Coy And Btc..,"No 132/5, Block 8 BTC Mills, Sivathapuram, Salem - 636307, Near Kattur",+(91)-0427-2480938
Jiyanshi Rajasthani Foods,"Mata Ji Ka Mandir, Osian, Jodhpur - 342303",07947170973
Mithran Exports,"No 1 New, Pethanachiyamman 1 St Street, Villapuram, Madurai - 625012, Near By Koodakovil School",07947266604
Anu Foods Appalam Manufactu..,"No 3298, Tnhb Colony West Anuppanady, Anuppanady, Madurai - 625009, Near Palayampatti Nadar Higher Secondary School",+(91)-9894457999
Kohiinoor Mills,"Shahabaug, Puna Mahabaleshwar Road, Wai, Satara - 412803, Near Shahabaug",07947316798
Shri Samarth Enterprises an..,"College Road, Gokul Colony, Rahuri, Ahmednagar - 413705, Near Bhagarathibai Vidyalay",+(91)-9096405808
Sadguru Masale And Dryfruit..,"Sry No -78 /3 , Plot No-19, Row House No-1, Vasantnagar, Khed, Khed Wadhe, Satara - 415003",07947317238
Bharati Products,"414, Siddhanath Society, Shivaji Chowk, Bhiwandi, Bhiwandi - 421302, Near Sai Mandir",07947331991
Janta Supreme Punjabi Atta,"Sardar Nagar No 3,, Hemant Manjrekar Marg, Sion Koliwada, Mumbai - 400022, Samaj Mandir Hall",07947168409
Asuvara Masalewale,"Plot No M 28, Satara MIDC, Satara - 415004, Additional MIDC, Back Side Of Top Gear Company",07947316374
A Amratlal & Co,"Building No 406, Ebrahim Rahemtulla Raod, Pydhonie, Mumbai - 400003, Oppo- Pydhoni Police Station",+(91)-022-23461548
Apana Masale,"A/p Kaledhon, Vita Mayani Road, Kaledhon Satara, Satara - 415312, Near Bank Of India",07947317286
