Toni&Guy Unisex Salon,"Office No.2, 1st Floor, New DP Road, Aundh, Aundh, Pune - 411007, Opposite Champions Sports, Near D-mart",+(91)-9922011299
Lakme Salon,"Ground Floor Mayur Center, Fc Road, Fergusson College Road, Pune - 411004, Opposite Rupali Restaurant",07947207248
Embellish Unisex Salon,"1st Floor, Madhav Building, Magarpatta Road, Hadapsar, Pune - 411028, Next to Amanora Mall, Above Indian Overseas Bank",07947203451
The Looks Hair and Beauty S..,"Kolte Patil ,Down Town Xenia ,Shop No-28, Kharadi, Pune - 411014, Near City Vista",07947206808
Bombay Saloon,"7 Star Lane, Brt Road, Pimple Saudagar, Pune - 411027, Near Govind Garden Chowk",07947203662
The New Salon Mystiique Ski..,"Gat 1420, Nagar Road, Wagholi, Pune - 412207, Near Wagheshwar Temple,Pune Nagar Highway, Above Andhra Bank Next to Maruti True Value Show Room",07947202330
Fascino Hair & Skin Lounge,"Shop No. 1, Beside Sonigara Laurel, Wakad, Pune - 411057, Near Mankar Chowk, Kaspate Vasti",07947202451
Inara Salon Wellness Spa an..,"Flat No 3, Shreeniwas Classic Co-op Housing Society, Main Baner Road Opposite Desiaroma, Baner, Pune - 411045, Above Union Bank",07947224785
Salon De Dilip Unisex Hair ..,"Shop 1 &13 ,14 Green Park Appartment, Pune Satara Road, Katraj, Pune - 411046, Opp Bharthi Vidya Peeth  Main Gate",07947199138
Rajasthan Beauty Parlour,"Survey No 39/1 Shop No 6, Jogeshwari Lane, Budhwar Peth, Pune - 411002, Near Tambde Jogeshwari Temple Next to Natraj Book Stall Appa Balwant Chowk",07947193601
Styvaana Unisex Fashion Sal..,"Wallstreet Office 101, Mumbai Banglore Highway, Warje, Pune - 411058, Near Shell Petrol Pump",07947462833
Jawed Habib Hairxpreso And ..,"Building No 5 Shop No 5 Gitanjali Kunj, Ambedkar Road, Camp, Pune - 411001, Near LAL Deval Opp To Nehru Memorial Hall",07947195983
New Diamond Mens Parlour,"Shop No 6, Amba Vatica Building, NIBM Road, NIBM-Kondhwa Khurd, Pune - 411048, Near Anandpurm Trust Hospital",07947193896
Stylin Unisex Salon,"Shop No 4, Parekh Residence, Panchwati Colony,, Talegaon Dabhade, Talegaon Dabhade - 410506, Front Of HondA Showroom",07947205026
Chenz Salon,"Shop No 5 And 6 Gaikwad Heights, Aundh, Pune - 411007, Anand Park",07947197950
R Kets Unisex Salon and Bea..,"Shop No 1, 2 & 3 Keshav Smruti Apartment, 197 Navi Peth, Navi Peth-Sadashiv Peth, Pune - 411030, Near Patkar Bhavan",07947204794
Ravis  Salon Pashan,"Shop No 32 C Mont Vert 2, Sus Road, Pashan, Pune - 411021, Opposite Abhinav Art College, Next to Reliance Fresh",07947311344
Studio 11 Salon & Spa,"Row House No.1 Ground Floor Lunkad Garden Co-op Housing Society, Datta Mandir Chowk, Viman Nagar, Pune - 411014, Near HDFC Bank",07947205691
Glow Unisex Salons,"Roohi Appt, Shop No 1, Gound Floor, Salunke Vihar Road, Wanowrie, Pune - 411040, Next Bhiwandi Darbar Hotel",07947479570
Beauty Temple,"Flat No 410, Building No 1, Gera Gardens, Bundgarden Road, Koregaon Park, Pune - 411001, Near Taj Blue Diamond",07947197420
Lane Six,"C 4 Akshalekha Society, Lane No 6, Koregaon Park, Pune - 411001, Near Kiva Hotel",07947201246
Apple Unisex Salon,"1st Floor Vision Galleria, Kunal Icon Road, Pimple Saudagar, Pune - 411027",07947198354
Sagars Hair Studio,"Shop No. 5, Opp Anand Nagar,, Paud Road, Kothrud, Pune - 411038, Near Palvi Hotel",07947203346
Ish Beauty parlour & leadie..,"Sai Kurpa, Kate Puram Chowk-Pimple Gurav OPP shirishna math, Pune - 411061",07947209029
Cutting Adge Unisex Salon,"Shop No L 10,Navkar Avenue, Bavdhan, Pune - 411021, Opposite NDA Pashan Road",07947199448
Sybarite Unisex Salons,"Office No 1 1st Floor Westend Shopping, D P Road, Aundh, Pune - 411007, Opposite D Mart",07947196651
Beauty Temple Salon,"Shonest Tower Survey 175/3&172/2., Wakad, Pune - 411057, Opp.omega Paradise,Wakad",07947207724
Marvelous Family Salon,"Sr. no 51/3, shop no.1, A J Arcade, New DP road, Kothrud, Pune - 411038, Opp Ashish Garden, next to buaa halwai",07947201286
Beauty Budget Unisex Salon,"Survey No 59/1 C 2nd Floor, Sinhagad Road-vadgaon Budruk, Pune - 411041, Abhiruchi Mall, Abhiruchi City Pride Multiplex",07947197723
The Gazelle,"Mayfair A Wing, Dhole Patil Road, Bs Dhole Patil Road, Pune - 411001",07947196279
Salon Apple,"Shop No 31& 32 Parmar Pavan Near Dominos, Kondhwa Khurd, Pune - 411048",+(91)-020-8617888
Komal Unisex Salon & Spa,"Shop No-6 Bizzbay Mall, NIBM Road, NIBM-Kondhwa Khurd, Pune - 411048, Opposite Clover Hills",07947201535
Rozy Salon,"Shop No 5 Sukhawani Park, North Main Road, Koregaon Park, Pune - 411001, Behind Rajput Dairy",07947194688
Prashant Hair Style And Gen..,"Dwarka Lords, Pimple Saudagar Road, Pimple Saudagar, Pune - 411027, Near Shiver Garden",07947194161
The Eves Beauty Salon and M..,"Shop No 6, Dharmavat Building, Near Talab Masjid, Kondhwa Road, Kondhwa Budruk, Pune - 411048, Near Infront Of Gagan Avenue",07947205220
Sindhu Batra Femme Salon,"Shop 230/231, 1st Floor, Victoria I, Fortleza, Kalyani Nagar, Pune - 411014, Near Kalyani Veg. Restaurant,  Above  Gkb Opticals",07947197743
7th Heaven,"104, Celestino, Dhanori Road, Dhanori, Pune - 411015, Near Jakaat Naka",07947198674
Magic Of Scissor Unisex Sal..,"2nd Floor Land Square Building, F C Road, Fergusson College Road, Pune - 411004, Next to Rupali Hotel Near Good Luck Chowk",07947201511
Elan Unisex Salon,"Shop No 10,11,12 Ganeesham 1st Floor, Pimple Saudagar, Pune - 411027, Sai Nagar Park",07947207256
Nitrogen Unisex Salon,"1884, Shop No 10,, Dnyaneshwar Paduka Chowk, Fergusson College Road, Pune - 411004, Beside Airtel Store, Near Niranjan Hotel",07947205475
Medi Hair Creation,"Shop 4 Loknath Society Mayur Colony, Kothrud, Pune - 411038, Near Jog School",07947198355
Eminence Hair & Beauty Stud..,"Shop no. 4 signet corner, Balewadi phata, Baner, Pune - 411045, Near Kotak Mahindra bank",07947200827
Vihaan The Unisex Salon,"Pune Satara Road, Katraj, Pune - 411046, Opp Bharati Hospital,Near Pizza Hut",07947198215
Aurum Salon & Academy,"2nd Floor,Shejwal Complex, Pune-Solapur Road, Hadapsar, Pune - 411028, Near Manohar Cloth,Bhaji Mandai Signal",07947203130
The Hair Corner,"SHOP 169, 1ST FLOOR, VISION 9 MALL, KUNAL ICON ROAD, Pimple Saudagar, Pune - 411027",07947202820
Sapphire Hair And Beauty Un..,"Shop No 37 Ganga Bhagyoday, Sinhgad Road, Manik Baug, Pune - 411051, Near Fun Multiplex",07947199200
Looks Matter Unisex Salon,"Shop No 7, 1st Floor, Darpan Housing Society Road, Sanewadi, Aundh, Pune - 411007, Opp Maharashtra Bank",07947479234
Apple Unisex Salon,"19/20 Vision Galleria. Mall, Kunal Icon Road, Pimple Saudagar, Pune - 411027",07947198723
The Gazelle,"Gera Harmony, Kalyani Nagar, Pune - 411014, Near ICICI Bank",07947196278
Coiffe Clipper Hair Studio ..,"Arihant. Plot No 27. Sector No 27a, Behind HDFC Bank, Off Radhika-Ashish Plaza,, Nigdi, Pune - 411044, Bhel Chowk. Pradhikaran.",07947197750
Giovani Salon On Wheels,"Siddhivilla Housing Society Aryan Row House No 1, Near Akurdi Railway Stn, Nigdi Pradhikaran, Pune - 411044, Sector 26",07947202913
Ki & Ka Salon,"Shop No 8, Atul Nagar, Undri, Pune - 411060, Opposite Euro School",07947203302
The S B Unisex Salon,"Shop No-4,Sai Classic Building, 40 Feet Road, Manjari Farm, Pune - 412307, Z Corner Manjari",07947479231
Hair Crafts Unisex Salon An..,"Hair Crafts, Canal Road Lane No 2, Karve Nagar, Pune - 411052, Vikas Mitra Mandal Chowk",07947200052
Krystal Unisex Salon,"Shop No 4 Mourya Appts, NIBM Road, NIBM-Kondhwa Khurd, Pune - 411048, Next to Sunshree Emerald",07947206300
Znr Family Salon,"Shop No.33,Bramha Majestic, NIBM Road, NIBM-Kondhwa Khurd, Pune - 411048, Behind Sarvodya Society",07947479541
Smitas Fashion Beauty Point,"Babarao Rokde Niwas, Near Water Tank Nanded Phata, Nanded Phata, Pune - 411068, Near Water Tank  Near Axis Bank",07947459319
Stylo Unisex Salon Next Gen,"Amar Smruddhi Shop No 07 08, Pune Solapur Road, Hadapsar, Pune - 411028",+(91)-8642838383
New Royal Mens Parlour,"Shop No 1, Balewadi Phata Road, Balewadi-Baner, Pune - 411045, Near Laxmi Mata Mandir",+(91)-9011356779
Jawed Habib Hair & Beauty S..,"B -Wing ,Office No-25, 5th Floor, Destination Center, Magarpatta City-Hadapsar, Pune - 411028",+(91)-20-67071603
Sejals International Academ..,"Flat No. 1, Bhatia Apartment, Park Avenue Society, DP Road, Aundh, Pune - 411007, Opposite Kotbagi Hospital",+(91)-020-24267881
Pjs Hair Unisex Salon & Tat..,"Shop No.8 Decision Tower, Pune Satara Road, Bibvewadi, Pune - 411037, Near Dominos",+(91)-9822947990
Salon Apple,"Shop No 1, Mandhare Niwas, Bibvewadi Kondhwa Road, Bibvewadi, Pune - 411037, Next to Kalyan Bhel",+(91)-9130563333
Head To Toes Hair And Beaut..,"Shop No 8 Samar Paradise, D P Road, Aundh, Pune - 411007, Opposite Shiv Sagar Restaurant Behind Subway",+(91)-9595922817
Under The Dryer,"Sn 678/A Sh.19 Soba Sanjapt, Bibvewadi, Pune - 411037, Near Bhagli Hospital",+(91)-9146009777
Lakme Salon,"Office No 101 Building C1 Serial No 58/2/1A, Kharadi, Pune - 411014, Opposite to Beryl Apartment",+(91)-7219211211
Look and Style Unisex Salon,"33/B, Ragvilas Society, North Main Road, Koregaon Park, Pune - 411001, Near Buddha Paradise",+(91)-8421535821
The Grooming Factory,"Shop No 1, Eon It Park, Kharadi, Pune - 411014, Near Pathare Thube Nagar",+(91)-9850398302
Rich Infinity Unisex Salon,"Shop No-45, Wing-B, Shopeers Orbit Mall, Alandi Road, Vishrantwadi, Pune - 411015, Near Union Bank Of India",07947202368
Afhair 9 Unisex Salon and M..,"Shop No 105, Business Enclave, Pancard Club Road, Baner, Pune - 411045, Near Krushna Medical Stores",+(91)-9826594945
Glam Studios Unisex Salon,"Shop No 01 Pradeep Plaza Ganga Platino East Wing, Eon It Park Road, Kharadi, Pune - 411014, Opposite Ganga Constella Society",+(91)-7820860018
Rk Brothers The Barber Shop,"Sr No 32/7/1, Jaee Residency Shop No 5, Katraj, Pune - 411046, Behind Trimurti Chowk Besides Flying Birds School",+(91)-8411807077
Krushnas Unisex Salon,"Shop No 1, Devyanishri Sarkari Gruhrachna, Paud Road, Kothrud, Pune - 411038, Near Croun Bakery Shivtirth Nagar",+(91)-9822753571
Moonlight Ladies Salon,"Shop No 5, Palash Plus Society, Pink City Road,, Wakad, Pune - 411057, Opposite Euro School,",+(91)-9970724710
Vega Hair Beauty and Spa,"Shop No 8, Deevesh Business Centre, Alandi Road, Vishrantwadi, Pune - 411015, Near Suyog Diagnostic Centre",+(91)-9673016780
Lakme Salon,"Shop No G 07, Upper Ground Floor, Dorabjees Royale Heritage, NIBM Road, NIBM-Kondhwa Khurd, Pune - 411048, Above D Mart Floor",+(91)-20-26731166
Petal Touch Beauty Salon,"Dwarkadesh Residency, Gate No 3, Pimple Saudagar, Pune - 411027, Opposite Bank Of Maharashtra Shivar Chowk",+(91)-20-27206289
Creative and Crazy Unisex S..,"Optimus Building, B Wing  1st Floor Shop No. 02 and 08, Viman Nagar, Pune - 411014, Opposite Lunkad Queensland Society",+(91)-8906262629
Fllorence Beauty Spa And Ma..,"Office No 3 1st Floor Shreeram Pride, Dhanori Lohegaon Road, Dhanori, Pune - 411015, Opposite Pilladium Grand",+(91)-9860991711
Amos Unisex Salon,"Shop No 203 2nd Floor Stellar Spaces, Kharadi, Pune - 411014, Opposite Zensar IT Park",+(91)-8806510251
Stylo Unisex Salon,"Mangaldas Society Shop No 5, Bhusari Colony  Paud Road, Kothrud, Pune - 411038, Near Vanaz Corner",+(91)-7378763854
House Of Beauty Salon,"R.k.life Space Society Shop No.13, Euro School Road, Wakad, Pune - 411057, Shankar Kalate Nagar Near Mauli Chauk",+(91)-9922113881
Ubuntu Salons,"Shop No.2, C1-2, Emirus, Baner Road ,Opposite Crosswind Society, Baner, Pune - 411045, Behind Syngenta Company, Near D Mart",+(91)-8484084813
Salon Apple,"Shop No 9 Rohan Plaza A Building Dp Road Next to Kumar Picasso, Hadapsar, Pune - 411028",+(91)-7709462255
Veronica Salon,"Shop No 45 Survey No 43 Durvankur Building, Kharadi, Pune - 411014, Near Kharadi Bypass Road",+(91)-8484004465
Senas Saloon Acadamy,"1st Floor,Savali Building, DP Road, Hadapsar, Pune - 411028, Opposite Mavla Hotel",+(91)-9922655447
RRITU Beauty Salon And Spa,"Epic Complex, Kesnand Road, Wagholi, Pune - 412207, Pmt Bus Stop Kesnand Phata",+(91)-9324168445
Lakme Salon,"First Floor, S.No.36/11,, Morwadi, Pimpri, Pune - 411018, Opposite Hotel Gharonda",+(91)-7722094447
Uday Mens Parlour and Body ..,"Lane No. 10 Raigad Colony Shop No 1 Sudharshan Appartment, Near Spencer Chouk, Karve Nagar-hingne Budrukh, Pune - 411052, Near Datta Mandir Sahid Mitra Mandal",07947480384
Spa Hair And Beauty Ladies ..,"3/19 Neeta Park Housing Society, Airport Road, Kalyani Nagar-Yerawada, Pune - 411006, Behind Shah Accident Hospital",+(91)-9359969247
Xperto Unisex Salon,"Shop No 7 Konark Business Center Sr No 36, Keshav Nagar-mundhawa, Pune - 411036, Near Renuka Mata Mandir",+(91)-9975163181
Shyams Beauty Salon and Spa,"Baif Road, Wagholi, Pune - 412207, Oop Nikam Hospital, Near Chulbul Dhaba",+(91)-7038519822
Kaina The Make Up Artist,"Maharashtra Housing Board, Building M10, Flat No. 1692, Airport Road, Yerawada, Pune - 411006",+(91)-9975177474
Style And Smile Unisex Salo..,"Shop No 11, Ground Floor ,Kapil Upvan, Lake Town Society Road, Bibvewadi, Pune - 411037, Near Balaji Traders",+(91)-9552503550
Vama Salon,"Shop No 19,Ground Flr, A Wing Shopper Orbit, Vishrantwadi, Pune - 411015, Nr Dominoz Pizza",+(91)-9922935907
K P Unisex Salon,"Shop No 11, Yashraj Primo, Handewadi, Pune - 411028, Near Satav Nagar, Opposite Namo Vihar Society",+(91)-9833739874
Miracle Ladies Beauty Parlo..,"Sr No 46 Shop No 4, Simonne Court, Kondhwa Khurd, Pune - 411048, Unity Park Road",+(91)-9970042559
VLCC Salon,"Off. A1,Sahyadri Heights,S.No.37/2B, Singhagad Road, Manik Baug, Pune - 411051, Opposite Shorba The Family Restaurant",+(91)-20-24606263
Lavish Unisex Salon,"Dp Road ,Parihar Chowk, Aundh, Pune - 411007, Near Blackberry , Opposite Of Unicorn",+(91)-9561262152
Salims Salon,"Hemo Colony Garden Shop No. 2 Kanchan Apt., J N Road, Pimpri, Pune - 411018, Near Ganesh Hotel",+(91)-9021987478
Salon De Dilip Unisex Hair ..,"Shop 1 &13 ,14 Green Park Appartment, Pune Satara Road, Katraj, Pune - 411046, Opp Bharthi Vidya Peeth  Main Gate",07947199138
Styvaana Unisex Fashion Sal..,"Wallstreet Office 101, Mumbai Banglore Highway, Warje, Pune - 411058, Near Shell Petrol Pump",07947462833
New Diamond Mens Parlour,"Shop No 6, Amba Vatica Building, NIBM Road, NIBM-Kondhwa Khurd, Pune - 411048, Near Anandpurm Trust Hospital",07947193896
Jawed Habib Hairxpreso And ..,"Building No 5 Shop No 5 Gitanjali Kunj, Ambedkar Road, Camp, Pune - 411001, Near LAL Deval Opp To Nehru Memorial Hall",07947195983
Ravis  Salon Pashan,"Shop No 32 C Mont Vert 2, Sus Road, Pashan, Pune - 411021, Opposite Abhinav Art College, Next to Reliance Fresh",07947311344
R Kets Unisex Salon and Bea..,"Shop No 1, 2 & 3 Keshav Smruti Apartment, 197 Navi Peth, Navi Peth-Sadashiv Peth, Pune - 411030, Near Patkar Bhavan",07947204794
Chenz Salon,"Shop No 5 And 6 Gaikwad Heights, Aundh, Pune - 411007, Anand Park",07947197950
Studio 11 Salon & Spa,"Row House No.1 Ground Floor Lunkad Garden Co-op Housing Society, Datta Mandir Chowk, Viman Nagar, Pune - 411014, Near HDFC Bank",07947205691
Apple Unisex Salon,"1st Floor Vision Galleria, Kunal Icon Road, Pimple Saudagar, Pune - 411027",07947198354
Beauty Temple,"Flat No 410, Building No 1, Gera Gardens, Bundgarden Road, Koregaon Park, Pune - 411001, Near Taj Blue Diamond",07947197420
Cutting Adge Unisex Salon,"Shop No L 10,Navkar Avenue, Bavdhan, Pune - 411021, Opposite NDA Pashan Road",07947199448
Glow Unisex Salons,"Roohi Appt, Shop No 1, Gound Floor, Salunke Vihar Road, Wanowrie, Pune - 411040, Next Bhiwandi Darbar Hotel",07947479570
Sagars Hair Studio,"Shop No. 5, Opp Anand Nagar,, Paud Road, Kothrud, Pune - 411038, Near Palvi Hotel",07947203346
Ish Beauty parlour & leadie..,"Sai Kurpa, Kate Puram Chowk-Pimple Gurav OPP shirishna math, Pune - 411061",07947209029
Stylin Unisex Salon,"Shop No 4, Parekh Residence, Panchwati Colony,, Talegaon Dabhade, Talegaon Dabhade - 410506, Front Of HondA Showroom",07947205026
Sybarite Unisex Salons,"Office No 1 1st Floor Westend Shopping, D P Road, Aundh, Pune - 411007, Opposite D Mart",07947196651
Komal Unisex Salon & Spa,"Shop No-6 Bizzbay Mall, NIBM Road, NIBM-Kondhwa Khurd, Pune - 411048, Opposite Clover Hills",07947201535
Salon Apple,"Shop No 31& 32 Parmar Pavan Near Dominos, Kondhwa Khurd, Pune - 411048",+(91)-020-8617888
The Eves Beauty Salon and M..,"Shop No 6, Dharmavat Building, Near Talab Masjid, Kondhwa Road, Kondhwa Budruk, Pune - 411048, Near Infront Of Gagan Avenue",07947205220
Rozy Salon,"Shop No 5 Sukhawani Park, North Main Road, Koregaon Park, Pune - 411001, Behind Rajput Dairy",07947194688
The Gazelle,"Mayfair A Wing, Dhole Patil Road, Bs Dhole Patil Road, Pune - 411001",07947196279
Ms Pooja (Abhiruchi Mall),"Abhiruchi Mall, 1st Floor, Pune Sinhagad Road, Sinhagad Road-vadgaon Budruk, Pune - 411041, Abhiruchi City Pride Multiplex",07947201047
Marvelous Family Salon,"Sr. no 51/3, shop no.1, A J Arcade, New DP road, Kothrud, Pune - 411038, Opp Ashish Garden, next to buaa halwai",07947201286
Hair Crafts Unisex Salon An..,"Hair Crafts, Canal Road Lane No 2, Karve Nagar, Pune - 411052, Vikas Mitra Mandal Chowk",07947200052
Nitrogen Unisex Salon,"1884, Shop No 10,, Dnyaneshwar Paduka Chowk, Fergusson College Road, Pune - 411004, Beside Airtel Store, Near Niranjan Hotel",07947205475
Magic Of Scissor Unisex Sal..,"2nd Floor Land Square Building, F C Road, Fergusson College Road, Pune - 411004, Next to Rupali Hotel Near Good Luck Chowk",07947201511
Medi Hair Creation,"Shop 4 Loknath Society Mayur Colony, Kothrud, Pune - 411038, Near Jog School",07947198355
Beauty Temple Salon,"Shonest Tower Survey 175/3&172/2., Wakad, Pune - 411057, Opp.omega Paradise,Wakad",07947207724
Eminence Hair & Beauty Stud..,"Shop no. 4 signet corner, Balewadi phata, Baner, Pune - 411045, Near Kotak Mahindra bank",07947200827
7th Heaven,"104, Celestino, Dhanori Road, Dhanori, Pune - 411015, Near Jakaat Naka",07947198674
Aurum Salon & Academy,"2nd Floor,Shejwal Complex, Pune-Solapur Road, Hadapsar, Pune - 411028, Near Manohar Cloth,Bhaji Mandai Signal",07947203130
Vihaan The Unisex Salon,"Pune Satara Road, Katraj, Pune - 411046, Opp Bharati Hospital,Near Pizza Hut",07947198215
Sapphire Hair And Beauty Un..,"Shop No 37 Ganga Bhagyoday, Sinhgad Road, Manik Baug, Pune - 411051, Near Fun Multiplex",07947199200
Lane Six,"C 4 Akshalekha Society, Lane No 6, Koregaon Park, Pune - 411001, Near Kiva Hotel",07947201246
The Gazelle,"Gera Harmony, Kalyani Nagar, Pune - 411014, Near ICICI Bank",07947196278
Krystal Unisex Salon,"Shop No 4 Mourya Appts, NIBM Road, NIBM-Kondhwa Khurd, Pune - 411048, Next to Sunshree Emerald",07947206300
Prashant Hair Style And Gen..,"Dwarka Lords, Pimple Saudagar Road, Pimple Saudagar, Pune - 411027, Near Shiver Garden",07947194161
Looks Matter Unisex Salon,"Shop No 7, 1st Floor, Darpan Housing Society Road, Sanewadi, Aundh, Pune - 411007, Opp Maharashtra Bank",07947479234
Apple Unisex Salon,"19/20 Vision Galleria. Mall, Kunal Icon Road, Pimple Saudagar, Pune - 411027",07947198723
Elan Unisex Salon,"Shop No 10,11,12 Ganeesham 1st Floor, Pimple Saudagar, Pune - 411027, Sai Nagar Park",07947207256
Znr Family Salon,"Shop No.33,Bramha Majestic, NIBM Road, NIBM-Kondhwa Khurd, Pune - 411048, Behind Sarvodya Society",07947479541
Giovani Salon On Wheels,"Siddhivilla Housing Society Aryan Row House No 1, Near Akurdi Railway Stn, Nigdi Pradhikaran, Pune - 411044, Sector 26",07947202913
Ki & Ka Salon,"Shop No 8, Atul Nagar, Undri, Pune - 411060, Opposite Euro School",07947203302
The S B Unisex Salon,"Shop No-4,Sai Classic Building, 40 Feet Road, Manjari Farm, Pune - 412307, Z Corner Manjari",07947479231
Coiffe Clipper Hair Studio ..,"Arihant. Plot No 27. Sector No 27a, Behind HDFC Bank, Off Radhika-Ashish Plaza,, Nigdi, Pune - 411044, Bhel Chowk. Pradhikaran.",07947197750
Smitas Fashion Beauty Point,"Babarao Rokde Niwas, Near Water Tank Nanded Phata, Nanded Phata, Pune - 411068, Near Water Tank  Near Axis Bank",07947459319
Sindhu Batra Femme Salon,"Shop 230/231, 1st Floor, Victoria I, Fortleza, Kalyani Nagar, Pune - 411014, Near Kalyani Veg. Restaurant,  Above  Gkb Opticals",07947197743
Stylo Unisex Salon Next Gen,"Amar Smruddhi Shop No 07 08, Pune Solapur Road, Hadapsar, Pune - 411028",+(91)-8642838383
New Royal Mens Parlour,"Shop No 1, Balewadi Phata Road, Balewadi-Baner, Pune - 411045, Near Laxmi Mata Mandir",+(91)-9011356779
Jawed Habib Hair & Beauty S..,"B -Wing ,Office No-25, 5th Floor, Destination Center, Magarpatta City-Hadapsar, Pune - 411028",+(91)-20-67071603
Sejals International Academ..,"Flat No. 1, Bhatia Apartment, Park Avenue Society, DP Road, Aundh, Pune - 411007, Opposite Kotbagi Hospital",+(91)-020-24267881
Pjs Hair Unisex Salon & Tat..,"Shop No.8 Decision Tower, Pune Satara Road, Bibvewadi, Pune - 411037, Near Dominos",+(91)-9822947990
Salon Apple,"Shop No 1, Mandhare Niwas, Bibvewadi Kondhwa Road, Bibvewadi, Pune - 411037, Next to Kalyan Bhel",+(91)-9130563333
Head To Toes Hair And Beaut..,"Shop No 8 Samar Paradise, D P Road, Aundh, Pune - 411007, Opposite Shiv Sagar Restaurant Behind Subway",+(91)-9595922817
Under The Dryer,"Sn 678/A Sh.19 Soba Sanjapt, Bibvewadi, Pune - 411037, Near Bhagli Hospital",+(91)-9146009777
Lakme Salon,"Office No 101 Building C1 Serial No 58/2/1A, Kharadi, Pune - 411014, Opposite to Beryl Apartment",+(91)-7219211211
Look and Style Unisex Salon,"33/B, Ragvilas Society, North Main Road, Koregaon Park, Pune - 411001, Near Buddha Paradise",+(91)-8421535821
The Grooming Factory,"Shop No 1, Eon It Park, Kharadi, Pune - 411014, Near Pathare Thube Nagar",+(91)-9850398302
Rich Infinity Unisex Salon,"Shop No-45, Wing-B, Shopeers Orbit Mall, Alandi Road, Vishrantwadi, Pune - 411015, Near Union Bank Of India",07947202368
Vega Hair Beauty and Spa,"Shop No 8, Deevesh Business Centre, Alandi Road, Vishrantwadi, Pune - 411015, Near Suyog Diagnostic Centre",+(91)-9673016780
Lakme Salon,"Shop No G 07, Upper Ground Floor, Dorabjees Royale Heritage, NIBM Road, NIBM-Kondhwa Khurd, Pune - 411048, Above D Mart Floor",+(91)-20-26731166
Glam Studios Unisex Salon,"Shop No 01 Pradeep Plaza Ganga Platino East Wing, Eon It Park Road, Kharadi, Pune - 411014, Opposite Ganga Constella Society",+(91)-7820860018
Krushnas Unisex Salon,"Shop No 1, Devyanishri Sarkari Gruhrachna, Paud Road, Kothrud, Pune - 411038, Near Croun Bakery Shivtirth Nagar",+(91)-9822753571
Creative and Crazy Unisex S..,"Optimus Building, B Wing  1st Floor Shop No. 02 and 08, Viman Nagar, Pune - 411014, Opposite Lunkad Queensland Society",+(91)-8906262629
Amos Unisex Salon,"Shop No 203 2nd Floor Stellar Spaces, Kharadi, Pune - 411014, Opposite Zensar IT Park",+(91)-8806510251
Petal Touch Beauty Salon,"Dwarkadesh Residency, Gate No 3, Pimple Saudagar, Pune - 411027, Opposite Bank Of Maharashtra Shivar Chowk",+(91)-20-27206289
Fllorence Beauty Spa And Ma..,"Office No 3 1st Floor Shreeram Pride, Dhanori Lohegaon Road, Dhanori, Pune - 411015, Opposite Pilladium Grand",+(91)-9860991711
Stylo Unisex Salon,"Mangaldas Society Shop No 5, Bhusari Colony  Paud Road, Kothrud, Pune - 411038, Near Vanaz Corner",+(91)-7378763854
Lakme Salon Aundh,"Ground & 1st Floor, Shreeji Paradise, Aundh, Pune - 411007, Above IDBI Bank, Near Medipoint Hospital",+(91)-8308360000
House Of Beauty Salon,"R.k.life Space Society Shop No.13, Euro School Road, Wakad, Pune - 411057, Shankar Kalate Nagar Near Mauli Chauk",+(91)-9922113881
Veronica Salon,"Shop No 45 Survey No 43 Durvankur Building, Kharadi, Pune - 411014, Near Kharadi Bypass Road",+(91)-8484004465
Rk Brothers The Barber Shop,"Sr No 32/7/1, Jaee Residency Shop No 5, Katraj, Pune - 411046, Behind Trimurti Chowk Besides Flying Birds School",+(91)-8411807077
Moonlight Ladies Salon,"Shop No 5, Palash Plus Society, Pink City Road,, Wakad, Pune - 411057, Opposite Euro School,",+(91)-9970724710
Afhair 9 Unisex Salon and M..,"Shop No 105, Business Enclave, Pancard Club Road, Baner, Pune - 411045, Near Krushna Medical Stores",+(91)-9826594945
RRITU Beauty Salon And Spa,"Epic Complex, Kesnand Road, Wagholi, Pune - 412207, Pmt Bus Stop Kesnand Phata",+(91)-9324168445
Senas Saloon Acadamy,"1st Floor,Savali Building, DP Road, Hadapsar, Pune - 411028, Opposite Mavla Hotel",+(91)-9922655447
Ubuntu Salons,"Shop No.2, C1-2, Emirus, Baner Road ,Opposite Crosswind Society, Baner, Pune - 411045, Behind Syngenta Company, Near D Mart",+(91)-8484084813
Lakme Salon,"First Floor, S.No.36/11,, Morwadi, Pimpri, Pune - 411018, Opposite Hotel Gharonda",+(91)-7722094447
Spa Hair And Beauty Ladies ..,"3/19 Neeta Park Housing Society, Airport Road, Kalyani Nagar-Yerawada, Pune - 411006, Behind Shah Accident Hospital",+(91)-9359969247
Shyams Beauty Salon and Spa,"Baif Road, Wagholi, Pune - 412207, Oop Nikam Hospital, Near Chulbul Dhaba",+(91)-7038519822
Xperto Unisex Salon,"Shop No 7 Konark Business Center Sr No 36, Keshav Nagar-mundhawa, Pune - 411036, Near Renuka Mata Mandir",+(91)-9975163181
Kaina The Make Up Artist,"Maharashtra Housing Board, Building M10, Flat No. 1692, Airport Road, Yerawada, Pune - 411006",+(91)-9975177474
Uday Mens Parlour and Body ..,"Lane No. 10 Raigad Colony Shop No 1 Sudharshan Appartment, Near Spencer Chouk, Karve Nagar-hingne Budrukh, Pune - 411052, Near Datta Mandir Sahid Mitra Mandal",07947480384
Salon Apple,"Shop No 9 Rohan Plaza A Building Dp Road Next to Kumar Picasso, Hadapsar, Pune - 411028",+(91)-7709462255
K P Unisex Salon,"Shop No 11, Yashraj Primo, Handewadi, Pune - 411028, Near Satav Nagar, Opposite Namo Vihar Society",+(91)-9833739874
Vama Salon,"Shop No 19,Ground Flr, A Wing Shopper Orbit, Vishrantwadi, Pune - 411015, Nr Dominoz Pizza",+(91)-9922935907
Miracle Ladies Beauty Parlo..,"Sr No 46 Shop No 4, Simonne Court, Kondhwa Khurd, Pune - 411048, Unity Park Road",+(91)-9970042559
