Mehek Beauty Saloon and Aca..,"202, Kalash Complex, Karelibaug, Vadodara - 390018, Near Muktanand Circle",07947314947
Fringe Beauty Studio,"8, 1st Floor, Balaji Exotica, Chhani Road, Vadodara - 390024, Opposite Vraj Flat, TP 13",+(91)-9974706503
Panchsheel Hair Dresser & B..,"Shop No 7, B Saikrupa Society, Water Tank Road, Karelibaug, Vadodara - 390018, Near SAI Baba Temple",+(91)-9428880502
The Grand Look Unisex Salon,"Shop No 39 Bevind Galaxy Ground Flour, Kalali, Vadodara - 390012, Nr Chanakya Nagari",+(91)-9824228793
JayDev Beauty Parlour,"B-6, Snehkunj Society, Near Shanti Nagar, Gorwa, Gorwa Vadodara, Vadodara - 390003, Sneh Kunj",+(91)-8849954684
The V1 Studio And Saloon,"15, Ground Floor, Vrajvenu Resicum Plaza, Waghodia Dabhoi Ring Road, Waghodia Road, Vadodara - 390025, Opposite Swaminarayan Gurukul",+(91)-9737806122
Samir Haircut & Beauty Salo..,"Shop No 7, Dwarkadhish Complex, Sama Savli Road, Vip Circle, Vadodara - 390002, Near Amit Nagar Circle",+(91)-9824072157
